Job Name,Company Name,Location,Salary,Description
Backend Java Developer,RepTime Sales Software,NA,25000 - 35000,"Looking for Java Developer with Springboot hands-on.Hands-on individual responsible for producing excellent quality of code, adhering to expected coding…"
Backend Developer - E- Learning,EduBridge Learning Pvt.Ltd,"Mumbai, Maharashtra",NA,"We are looking for an experienced and accomplished DevOps and Back-end Developer (Golang, Clojure, Ruby on Rails) to build the LMS.Temporarily due to COVID-19."
Hiring for Backend Developer Nodejs / AWS/SQL,Tiara Consulting Services,"Andheri, Mumbai, Maharashtra",30000 - 60000,We are looking for 3 candidates with Relative Experience of (1-4 years) in Backend Engineering on a high priority.*.It is the most important.
Backend Developer,SoftTech Services,"Bengaluru, Karnataka",NA,Should be able to Integrate user-facing elements developed by front-end developers with server side logic.We are a fast growing Managed Service Provider with…
Backend Developer,Schbang Digital Solutions Pvt Ltd,"Mumbai, Maharashtra",NA,Ability to work closely with front end developers.Taking ready HTML/CSS files from front end developers and executing the project based on the logic and…
Freshers - iOS Developer,Tech Exactly,India,NA,Collaborate with backend team for API planning and execution.Design and Develop native iOS applications using Swift.Publish apps on App Store.
Backend Developer,Tripoto,"New Delhi, Delhi",NA,1-5 years of experience in designing and developing complex backend systems.A strong presence on developer websites like GitHub and StackOverflow is a plus.
Android Developer,Edzeal Technologies,"Pune, Maharashtra",NA,"8)Git ,as well as backend skills.We are looking for an Android developer responsible for the development and maintenance of applications aimed at a vast number…"
MEAN Stack Developer,ARL IT Services,"Mumbai, Maharashtra",600000 - 750000,Hands on work experience on MEAN Stack i.e.Angular 2+ experience min 1 year.Backend Technologies - Node js min 1 year.Job Type : Full-time Permanent job.
Web Developer,Wise,India,NA,Demonstrated accomplishments as a web developer.Here's what you'll do at Wise.You’ll be the Web Developer at Wise.Who does this role report to?
Cosmos DB Back end Developer,Larsen & Toubro Infotech Limited,India,NA,Backend developer with non-SQL data modelling experience specifically in Cosmos DB.Hands on/skilled in data retrival techniques and design data model to suite…
Android Backend Developer,Unique IT Tech,"Haridwar, Uttarakhand",12000 - 16000,"Candidate should have knowledge of frontend and backend both.Salary: ₹12,000.00 - ₹16,000.00 per month.Android development: 1 year (Required)."
Backend Developer,Blue Tokai Coffee Roasters,"Delhi, Delhi",NA,We are looking for incredible people that are also very passionate and experienced developers to join our office in Delhi.The role is yours to make.
Software Developer Backend,HIRING STREET,"Chennai, Tamil Nadu",NA,Salary: Not Disclosed by Recruiter.Industry:IT-Software / Software Services.Functional Area:IT Software - System Programming.
Backend Developer_Node js developer,Basidia Learning Pvt Ltd,"Bengaluru, Karnataka",300000 - 500000,Node.JS developer: 2 years (Preferred).We are looking for NodeJS Developers who can design and develop backend applications that are highly robust and scalable…
PYTHON Developer Role,HighIQ Robotics,"Hyderabad, Telangana",NA,Writing scalable backend applications in Python.We are looking for an experienced and passionate Python Developer with 1-3 years’ experience is Preferable.
Android Developer,Kuwy Technology,"Chennai, Tamil Nadu",300000 - 600000,Job Summary* – To take up the challenges and build the applications by integrating the backend services.Should be able to think and design the wireframes based…
Full Stack Javascript Developer,Paper Plane Solutions.,"Mumbai, Maharashtra",NA,"PaperPlane is looking for a Full Stack Javascript Developer who will use a combination of HTML, CSS, and JavaScript to build everything a user sees and…"
 JavaScript / React Native / Redux Developer,classpro,"Mumbai, Maharashtra",NA,We are looking for talented Javascript developer who want to join our engineering team to build great application for Education domain.
Backend developer (LE) - .Net,QuEST Global Engineering,"Thiruvananthapuram, Kerala",NA,"Backend developer with Cloud Technologies - .Net.6 to 8 years Good in C#.net, Rest API, .net core.Conversant with Design patterns, Data structures, Databases,…"
Software Engineer,EveryCrave Webteck Pvt Ltd,"Bengaluru, Karnataka",10000 - 40000,We are looking for developers with Python/Javascript experience and definitely apply if you have any WebRTC experience.Temporarily due to COVID-19.
Backend/Node js Developer (2+ yrs exp),NPAV,"Pune, Maharashtra",NA,"At least 2 years of experience as a Node JS developer is required.Design, build and maintain high performance, reusable, and reliable code."
Frontend / Backend Developer,DAXTA TECH,NA,30000 - 45000,The employee would get an opportunity to work on core frontend/backend development.Required urgent Frontend/Backend Developer for an edtech startup.
Frontend / Backend Developer,DAXTA TECH,NA,30000 - 45000,The employee would get an opportunity to work on core frontend/backend development.Required urgent Frontend/Backend Developer for an edtech startup.
Android Developer,AMCI,India,NA,Familiarity with RESTful APIs to connect Android applications to backend services.Java. The most basic building block of Android development is the programming…
Full Stack Developer,AV Zero Touch Pvt. Ltd,"Hyderabad, Telangana",NA,"We are a startup in search of a Full Stack Developer who’s a jack of all trades, transitioning seamlessly between front and backend coding."
HTML Developer,Infoky,"Noida, Uttar Pradesh",NA,"Create high performance, secure, responsive, clean and simple front-end builts in collaboration and discussion with backend developers, designers and product…"
Web / API Developer - LAMP Stack (Remote),Wing Operations & Technologies India,"Bengaluru, Karnataka",40000 - 50000,"Experience building frontend and backend for dynamic web applications for internal and external use.Hires in this role will work on backend systems, internal…"
Backend Developer (API Lead),Hitachi Vantara,"Hyderabad, Telangana",NA,"Hitachi Vantara, a wholly-owned subsidiary of Hitachi, Ltd., guides our customers from what’s now to what’s next by solving their digital challenges."
Frontend / Backend Developer,DAXTA TECH,NA,30000 - 45000,The employee would get an opportunity to work on core frontend/backend development.Required urgent Frontend/Backend Developer for an edtech startup.
Flutter Developer,Noviindus Technologies,"Calicut, Kerala",NA,Your primary focus will be the development of Android applications and their backend integration.You will need to work along-side other developers and…
Java - Backend Developer,Auxo Technology Labs,"Chennai, Tamil Nadu",NA,We are looking for an experienced Back-end developer to join our team!Auxo Labs is a venture capital-funded company founded in 2014 with innovation and a keen…
Backend Developer,Ushva,"Vikhroli, Mumbai, Maharashtra",NA,"In Lead Backend Developer role, you will -.Develop high quality, highly available systems within Ushva service oriented architecture.Bonus points if you have:"
C++ Developer - Media Applications,PerfectVIPs,"Bengaluru, Karnataka",NA,"Experienced C++ developer for a team that develops application software (UI and backend) at Sony India Software Center, Bangalore.4-6 years of work experience."
PHP – Laravel Developer – Backend,CareerXperts,"Bengaluru, Karnataka",NA,"Work on backend development activities, solutions, methods, and practices.We are seeking an innovative and engaged PHP developer who is motivated, creative,…"
Backend Engineer,Vtiger,"Bengaluru, Karnataka",NA,"You should be a self managed developer and be able to handle tasks independently.As a Backend Engineer, you will be responsible for implementing new features,…"
Urgent Requirement for Sr. Python Developer,Digi Interface,"Mumbai, Maharashtra",NA,Create products and backend api's as described by the business team.Code the backend of logics for consumption by the UI team.IIT graduation is a plus.
Senior Backend Engineer,TRANSERVE,"Panaji, Goa",800000 - 1200000,5+ years experience as Node.js developer.Transerve is looking for smart backend developers to work with our product development team to develop solutions for…
Full Stack Developer,Xoxoday,"Bengaluru, Karnataka",436292 - 1365167,"You will be responsible for developing and designing front end web architecture, ensuring the responsiveness of applications and working alongside graphic…"
PHP Developer,EngineerBabu,"Indore, Madhya Pradesh",NA,Utilize backend data services and contribute to increase existing data services API.We are looking for a motivated PHP / Laravel developer to come join our…
Python/Django Developer,Vikn Codes,"Unnikulam, Kerala",10000 - 30000,"We are looking for a Python/Django Developer, who is motivated to utilize skills in developing a long-lasting product with value addition to the current…"
Android Developer,Quick Infotech,"Lucknow, Uttar Pradesh",20000,We are looking for technically savvy and passionate Android developer to cater to the development and testing efforts in frontend and backend area.
Android Developer,Qualtech Telesys Private Limited,"Bengaluru, Karnataka",25000,"Location: ITI-KR PURAM-BANGALORE.Languages known: Kannada, Telugu, Hindi and English.*.Strong/Good knowledge in UI/UX Design and development."
"Net Developer,",Grow4sure,"Delhi, Delhi",65000,"Programming Languages: DOT NET (C#, ASP.2)Web Technologies: Angular, JavaScript, J-query, JSON, Web API, Web Services.Net Zero (Asp.Net Core)."
EDI Massaging with JAVA Backend Developer 5+ exp,"CGI Group, Inc.","Chennai, Tamil Nadu",NA,"General EDI knowledge such as EDIFACT and XML formats such as UBL.Basic understanding of Java, ability to make small changes to TE2 code which reminds Java."
PHP Developer,Nirals,"Madurai, Tamil Nadu",10000,"BE/BTech in CSE/ECE/IT/.Salary: ₹10,000.00 per month.Total work: 1 year (Preferred).Temporarily due to COVID-19."
NodeJS Backend Developer,Green Apple Solutions,"New Delhi, Delhi",NA,JS developer to drive our backend operations for our products Sparq/SearchTap.Integration of user-facing elements developed by front-end developers with server…
Frontend Developer,Ephicacy,India,NA,Work with the backend development team to integrate front-end code.Experience: 4 to 9 years.Qualification: Bachelor/Master’s degree in Engineering.
Wordpress Developer,A Reknown Organization,"Jaipur, Rajasthan",25000 - 30000,"Should have experience in backend and frontend development.Should have good experience in Wordpress development.Write clean, well designed code ."
Mobile Application Developer – iOS + Android Developer,TeamPlus Staffing Solution Pvt Ltd,"Kothrud, Pune, Maharashtra",NA,Note : Its a Contract Job for 6 Months + Extendable.Design and build advanced native applications for the iOS and Android platforms.Knowledge of UX and UI.
MEAN Stack Developer,CyBuzzSC Infotech Pvt. Ltd.,"Gurgaon, Haryana",26000 - 45000,Working and managing a team of developers.Location: * Currently WFH and eventually Gurgaon NCR.The primary focus will be the development of all server-side…
Senior Python Developer,Quantsapp Private Limited,NA,500000 - 700000,Create products and backend API's as described by the business team.Code the backend of logic for consumption by the UI team.IIT graduation is a plus.
SE ‐ Java Developer,Pace Wisdom Solutions,"Bengaluru, Karnataka",NA,"Write quality backend code primarily in Java REST API(JAX RS), Spring.2+ years’ experience as a Java Developer.Strong proficiency with API (REST) integration."
Android App Developer,ThinkStart,"Jaipur, Rajasthan",NA,Looking for android developer who can work collaboratively with backend engineers to create an amazing product that our community will love to use.
Backend Engineer (Python),Positivenaick,"Chennai, Tamil Nadu",NA,"As a backend developer, you’ll be expected to handle the following tasks on a day-to-day basis,.You love solving insane problems intelligently with AI, and…"
Android 2-3 Yrs. Experienced Developer,Prosols Technology,"Pune, Maharashtra",NA,Added Advantage: Web Services Implementation knowledge in PHP and backend development.Should have strong fundamental knowledge of Android development.
JavaScript Developer,Adrobit Technologies,"Kolkata, West Bengal",NA,Willingness to learn the entire stack of frontend and backend technologies.We have a new open position for Web/JavaScript developer.
Android Developer,The One Technologies,"Ahmedabad, Gujarat",NA,Must have knowledge about various kind of backend services like XML/JSON / SOAP Web services.Sound development knowledge of Android applications and different…
PHP Web Developer,Startiyo Business Solutions,"Calicut, Kerala",NA,"We are looking for a passionate Software engineer to design, develop and support our front end and backend systems.Expected Start Date: 15/8/2020."
Backend Engineer,BharatPe,"New Delhi, Delhi",NA,We’re looking for a solid backend engineer who has super powers in designing and building great backend architecture and data delivering tools.
Senior Backend Engineer,Antal International,"Mumbai, Maharashtra",NA,"The backend development team , you will be responsible.Enhance Analytics and overall backend architecture for better performance.Experience in PHP is a plus."
Laravel Developer,Hipster,"Lucknow, Uttar Pradesh",NA,Collaborate and work with frontend and mobile app developers on the backend needs of projects.Perform UI/backend tests to optimize performance.
Web Designer,volio technologies ltd,"HITEC City, Hyderabad, Telangana",NA,Coordinating with backend programmers/software developers for specialized scripts.Looking for an enthusiastic person for the role of web designers having…
Android Developer,Orfosis Infotech pvt ltd,"Surat, Gujarat",15000 - 30000,Excellent opportunity to build devices and tablets from scratch.and also find back-end developer.We are looking for a passionate and enthusiastic Android…
Java backend and Database developer,State Street,NA,NA,"Qualified developers should have solid working knowledge of.Global link, a division of State Street Global Markets, is a leader in providing electronic trading…"
Laravel Developer,HackerKernel,"Bhopal, Madhya Pradesh",10000 - 21000,Work on Laravel PHP as lead developer.Good understanding of backend laravel API development.Require candidates to have atleast 1 year of work experience on…
Node js developer,RadicalStart Infolab (P) Limited,NA,15000 - 50000,Minimum of 1+ Year Real-time Experience in ReactJS/NodeJS/AngularJS.Good Understanding of Structured and Unstructured Databases (MySQL and Mongo Db).
Wordpress Developer,JD Softtech,NA,30000 - 50000,We are looking for a WordPress PHP developer to work on our plugin and building addon modules along with supporting customization requests.
Jr.SAP FIORI &oDATA Consultant on Abap,Prime Plus Consultancy&solution,NA,25000 - 28000,Good understanding and experience in FIORI Development using WEB IDE and Eclipse tools along with backend integration.Wanted SAP Aabp Odata & fiori Developer.
Jr.SAP FIORI &oDATA Consultant on Abap,Prime Plus Consultancy&solution,NA,25000 - 28000,Good understanding and experience in FIORI Development using WEB IDE and Eclipse tools along with backend integration.Wanted SAP Aabp Odata & fiori Developer.
Jr.SAP FIORI &oDATA Consultant on Abap,Prime Plus Consultancy&solution,NA,25000 - 28000,Good understanding and experience in FIORI Development using WEB IDE and Eclipse tools along with backend integration.Wanted SAP Aabp Odata & fiori Developer.
Jr.SAP FIORI &oDATA Consultant on Abap,Prime Plus Consultancy&solution,NA,25000 - 28000,Good understanding and experience in FIORI Development using WEB IDE and Eclipse tools along with backend integration.Wanted SAP Aabp Odata & fiori Developer.
Jr.SAP FIORI &oDATA Consultant on Abap,Prime Plus Consultancy&solution,NA,25000 - 28000,Good understanding and experience in FIORI Development using WEB IDE and Eclipse tools along with backend integration.Wanted SAP Aabp Odata & fiori Developer.
Jr.SAP FIORI &oDATA Consultant on Abap,Prime Plus Consultancy&solution,NA,25000 - 28000,Good understanding and experience in FIORI Development using WEB IDE and Eclipse tools along with backend integration.Wanted SAP Aabp Odata & fiori Developer.
Testing Developer,ITC Infotech,"Bengaluru, Karnataka",NA,"Experience working in a development team in the role as quality engineer - Experience in QA processes and tools, test management systems, designing and running…"
Jr.SAP FIORI &oDATA Consultant on Abap,Prime Plus Consultancy&solution,NA,25000 - 28000,Good understanding and experience in FIORI Development using WEB IDE and Eclipse tools along with backend integration.Wanted SAP Aabp Odata & fiori Developer.
Jr.SAP FIORI &oDATA Consultant on Abap,Prime Plus Consultancy&solution,NA,25000 - 28000,Good understanding and experience in FIORI Development using WEB IDE and Eclipse tools along with backend integration.Wanted SAP Aabp Odata & fiori Developer.
Jr.SAP FIORI &oDATA Consultant on Abap,Prime Plus Consultancy&solution,NA,25000 - 28000,Good understanding and experience in FIORI Development using WEB IDE and Eclipse tools along with backend integration.Wanted SAP Aabp Odata & fiori Developer.
Jr.SAP FIORI &oDATA Consultant on Abap,Prime Plus Consultancy&solution,NA,25000 - 28000,Good understanding and experience in FIORI Development using WEB IDE and Eclipse tools along with backend integration.Wanted SAP Aabp Odata & fiori Developer.
Jr.SAP FIORI &oDATA Consultant on Abap,Prime Plus Consultancy&solution,NA,25000 - 28000,Good understanding and experience in FIORI Development using WEB IDE and Eclipse tools along with backend integration.Wanted SAP Aabp Odata & fiori Developer.
