Job_Name,Company_Name,Location,Salary,Description,Skills
IOS Developer,HashStudioz,"Sivakasi, Tamil Nadu",590000,Work with native modules when required.2+ years of professional experience working with React Native as well as professional software development.,"JavaScript,native iOS, Android development,React assumptions,Sentry,Bitrise,App Center,Redux,ESLint,Jest,React Native Testing Library,Problem-solving approach"
React Native Developer,Forpets Services,"Mumbai, Maharashtra",540000,"Greetings from Dynpro India pvt. Ltd .Hope you are looking for Job Change.Here We have an opportunity with MNC Company,.Role: Senior React JS Developer.","JavaScript,native iOS, Android development,React assumptions,Sentry,Bitrise,App Center,Redux,ESLint,Jest,React Native Testing Library,Problem-solving approach"
React Native Developer,Tara Blooms,"Bengaluru, Karnataka",480000,"Skill: Angular, rest api, Android Development, web api, typescript, react native.Excellent written, verbal communication and customer interfacing skills.","JavaScript,native iOS, Android development,React assumptions,Sentry,Bitrise,App Center,Redux,ESLint,Jest,React Native Testing Library,Problem-solving approach"
Mobile App (React Native) Developer(1-4 yrs),Sunshine Creative Labs,nan,480000,"Actively participate in code/design reviews with fellow mobile app developers.Understanding of Android/iOS internals, native APIs, push notifications,…","JavaScript,native iOS, Android development,React assumptions,Sentry,Bitrise,App Center,Redux,ESLint,Jest,React Native Testing Library,Problem-solving approach"
React Native Developer,Deven InfoTech,"Ahmedabad, Gujarat",540000,"Minimum 4 years of experience in building large scale mobiles apps using React Native.Architect, build, and maintain excellent React Native applications with…","JavaScript,native iOS, Android development,React assumptions,Sentry,Bitrise,App Center,Redux,ESLint,Jest,React Native Testing Library,Problem-solving approach"
Key Skills for Remote React Native Developer Jobs,CDK Global,"Ahmedabad, Gujarat",490000,"We are looking for a Hybrid Mobile App Developer.Proficient with Flutter or React Native.Proficient with HTML5/CSS3, JavaScript, Angular JS.","JavaScript,native iOS, Android development,React assumptions,Sentry,Bitrise,App Center,Redux,ESLint,Jest,React Native Testing Library,Problem-solving approach"
Mobile Developer_React Native,Talent Zone Consultants,nan,530000,"Looking for Android developers to develop/enhance our Android app.Qualification: Graduate, Post Graduate, Engineering.Develop and Improve Android App UI/UX.","JavaScript,native iOS, Android development,React assumptions,Sentry,Bitrise,App Center,Redux,ESLint,Jest,React Native Testing Library,Problem-solving approach"
React Native Developer - immediate joiner,Giriraj Digital,nan,540000,Have at least 2+ years of experience in react native development (Mandatory).Integrating and building native plugins.Job Code:RNDEV Key Skills:,"JavaScript,native iOS, Android development,React assumptions,Sentry,Bitrise,App Center,Redux,ESLint,Jest,React Native Testing Library,Problem-solving approach"
React Native Developer,MedRec Technologies,nan,560000,1.Minimum 5 years of strong real time experience in developing React JS based applications with Redux and/or iOS and Android native applications.,"JavaScript,native iOS, Android development,React assumptions,Sentry,Bitrise,App Center,Redux,ESLint,Jest,React Native Testing Library,Problem-solving approach"
React Developer,Star Knowledge,"New Town, Kolkata, West Bengal",580000,We are looking for talented Javascript developer who want to join our engineering team to build great application for Education domain.,"JavaScript,native iOS, Android development,React assumptions,Sentry,Bitrise,App Center,Redux,ESLint,Jest,React Native Testing Library,Problem-solving approach"
Mobile App (React Native) Developer(1-4 yrs),Bloom Consulting Services,"Visakhapatnam, Andhra Pradesh",450000,UI developers should be adept at Angular JS / Node.js / Material Design.We are looking for talented Javascript developer who want to join our engineering team…,"JavaScript,native iOS, Android development,React assumptions,Sentry,Bitrise,App Center,Redux,ESLint,Jest,React Native Testing Library,Problem-solving approach"
 JavaScript / React Native / Redux Developer,Giriraj Digital,"Chromepet, Chennai, Tamil Nadu",530000,"We are having urgent openings for a consultant role having strong experience in react, Node JS and AWS.Location Address: Pune, State of Mahārāshtra 610011…","JavaScript,native iOS, Android development,React assumptions,Sentry,Bitrise,App Center,Redux,ESLint,Jest,React Native Testing Library,Problem-solving approach"
HYBRID Mobile App Developer - Exp- 2 - 5 Years,Latlon Technologies,"Ahmedabad, Gujarat",490000,"Proven work experience from 1-4 years as a Mobile developer.Lunavo Labs* is a US-based remote software product experience company headquartered in SanDiego,…","JavaScript,native iOS, Android development,React assumptions,Sentry,Bitrise,App Center,Redux,ESLint,Jest,React Native Testing Library,Problem-solving approach"
iOS Developer,mplussoft,"Bengaluru, Karnataka",530000,Cross-platform mobile app developers who have developed mobile apps with a familiarity of React Native.Need to join immediately and start to work from home…,"JavaScript,native iOS, Android development,React assumptions,Sentry,Bitrise,App Center,Redux,ESLint,Jest,React Native Testing Library,Problem-solving approach"
React Native Developer,ABCPQR,Madhya Pradesh,530000,"Actively participate in code/design reviews with fellow mobile app developers.Understanding of Android/iOS internals, native APIs, push notifications,…","JavaScript,native iOS, Android development,React assumptions,Sentry,Bitrise,App Center,Redux,ESLint,Jest,React Native Testing Library,Problem-solving approach"
React Native Developer - immediate joiner,Creative Thoughts Informatics,nan,470000,"We are having urgent openings for a consultant role having strong experience in react, Node JS and AWS.Location Address: Pune, State of Mahārāshtra 610011…","JavaScript,native iOS, Android development,React assumptions,Sentry,Bitrise,App Center,Redux,ESLint,Jest,React Native Testing Library,Problem-solving approach"
React Native Developer,IndiaNIC,"Chandigarh, Chandigarh",470000,"Ability to create, develop & maintain React & React native application.Develop a flexible and well-structured front-end architecture.3rd floor, Plot No. 22,.","JavaScript,native iOS, Android development,React assumptions,Sentry,Bitrise,App Center,Redux,ESLint,Jest,React Native Testing Library,Problem-solving approach"
Mobile Developer (React Native),Protos Healthcare Technologies,"Chennai, Tamil Nadu",560000,"We are having urgent openings for a consultant role having strong experience in react, Node JS and AWS.Location Address: Pune, State of Mahārāshtra 610011…","JavaScript,native iOS, Android development,React assumptions,Sentry,Bitrise,App Center,Redux,ESLint,Jest,React Native Testing Library,Problem-solving approach"
Full Stack Developer,Alliance Tech,India,570000,"Looking for Android developers to develop/enhance our Android app.Qualification: Graduate, Post Graduate, Engineering.Develop and Improve Android App UI/UX.","JavaScript,native iOS, Android development,React assumptions,Sentry,Bitrise,App Center,Redux,ESLint,Jest,React Native Testing Library,Problem-solving approach"
React Native Developer,DynPro India Private Limited,"Chennai, Tamil Nadu",590000,Cross-platform mobile app developers who have developed mobile apps with a familiarity of React Native.Need to join immediately and start to work from home…,"JavaScript,native iOS, Android development,React assumptions,Sentry,Bitrise,App Center,Redux,ESLint,Jest,React Native Testing Library,Problem-solving approach"
Senior Front-end Engineer [ UI ],CDK Global,"Ramnathpara, Gujarat",460000,"Prior experience with native Mobile Application Development for iPhone and Android using (Objective-C and Swift, or Java).Experience with User Data Security.","JavaScript,native iOS, Android development,React assumptions,Sentry,Bitrise,App Center,Redux,ESLint,Jest,React Native Testing Library,Problem-solving approach"
React Native Developer,Protea Infotech,"Chennai, Tamil Nadu",470000,Leverage native APIs for deep integrations with both platforms.Diagnose and fix bugs and performance bottlenecks for performance that feels native.,"JavaScript,native iOS, Android development,React assumptions,Sentry,Bitrise,App Center,Redux,ESLint,Jest,React Native Testing Library,Problem-solving approach"
React Native App Developer,Lunavo Labs,nan,480000,"Services using other tech stacks can be mixed inReact (web) + React Native (native apps).Full Stack Developer FED - NODE JS, React Native - (0057211).","JavaScript,native iOS, Android development,React assumptions,Sentry,Bitrise,App Center,Redux,ESLint,Jest,React Native Testing Library,Problem-solving approach"
React Native Developer,CDK Global,"Pune, Maharashtra",520000,Developing new user-facing features using React.js.Building reusable components and front-end libraries for future use.React Native: 1 year (Preferred).,"JavaScript,native iOS, Android development,React assumptions,Sentry,Bitrise,App Center,Redux,ESLint,Jest,React Native Testing Library,Problem-solving approach"
Senior React Native Developer,Deven InfoTech,"Ahmedabad, Gujarat",490000,"Greetings from Dynpro India pvt. Ltd .Hope you are looking for Job Change.Here We have an opportunity with MNC Company,.Role: Senior React JS Developer.","JavaScript,native iOS, Android development,React assumptions,Sentry,Bitrise,App Center,Redux,ESLint,Jest,React Native Testing Library,Problem-solving approach"
JavaScript Developer,56N Software Pvt Ltd,nan,530000,Leverage native APIs for deep integrations with both platforms.Diagnose and fix bugs and performance bottlenecks for performance that feels native.,"JavaScript,native iOS, Android development,React assumptions,Sentry,Bitrise,App Center,Redux,ESLint,Jest,React Native Testing Library,Problem-solving approach"
Full Stack Developer,56N Software Pvt Ltd,"New Delhi, Delhi",450000,Looking for immediate or Serving Candidate who can join within 15 days.We are Looking React Native Mobile App Developer (Android / iOS).,"JavaScript,native iOS, Android development,React assumptions,Sentry,Bitrise,App Center,Redux,ESLint,Jest,React Native Testing Library,Problem-solving approach"
React Native/Ionic Developer Mobile,CDK Global,"Indore, Madhya Pradesh",560000,"We are having urgent openings for a consultant role having strong experience in react, Node JS and AWS.Location Address: Pune, State of Mahārāshtra 610011…","JavaScript,native iOS, Android development,React assumptions,Sentry,Bitrise,App Center,Redux,ESLint,Jest,React Native Testing Library,Problem-solving approach"
Mobile App Developer,CDK Global,"Hyderabad, Telangana",550000,"Urgent Hiring for React\_Native\_Developer..!!Ø Strong proficiency in React Native.Ø Experiencewith Swift, Objective-C or Java.#Experience* : 2 to 4 years.","JavaScript,native iOS, Android development,React assumptions,Sentry,Bitrise,App Center,Redux,ESLint,Jest,React Native Testing Library,Problem-solving approach"
iOS Developer,Appbylogic,"Calicut, Kerala",450000,"We are having urgent openings for a consultant role having strong experience in react, Node JS and AWS.Location Address: Pune, State of Mahārāshtra 610011…","JavaScript,native iOS, Android development,React assumptions,Sentry,Bitrise,App Center,Redux,ESLint,Jest,React Native Testing Library,Problem-solving approach"
React Native Developer - immediate joiner,Protos Healthcare Technologies,nan,520000,"Writes robust logical documentation that assists other developers.Design, implement, test and maintain node.js react application software.","JavaScript,native iOS, Android development,React assumptions,Sentry,Bitrise,App Center,Redux,ESLint,Jest,React Native Testing Library,Problem-solving approach"
Full stack developer,Place1India,nan,480000,"Title is ""Senior Mobile Application Developer"" and would be part of the IT team in our company - Tara Blooms Private Limited.(to support both iOS and Android).","JavaScript,native iOS, Android development,React assumptions,Sentry,Bitrise,App Center,Redux,ESLint,Jest,React Native Testing Library,Problem-solving approach"
Senior Frontend Developer,Lunavo Labs,nan,470000,"Good understanding of Android design guidelines, SDK and excellent JavaScript skills.Hands on experience with Hybrid development - React Native, JSX, Redux,…","JavaScript,native iOS, Android development,React assumptions,Sentry,Bitrise,App Center,Redux,ESLint,Jest,React Native Testing Library,Problem-solving approach"
React Native Developer,Protos Healthcare Technologies,"Mumbai, Maharashtra",540000,"We are having urgent openings for a consultant role having strong experience in react, Node JS and AWS.Location Address: Pune, State of Mahārāshtra 610011…","JavaScript,native iOS, Android development,React assumptions,Sentry,Bitrise,App Center,Redux,ESLint,Jest,React Native Testing Library,Problem-solving approach"
Full Stack Developer,Protea Infotech,"Bengaluru, Karnataka",490000,"Greetings from Dynpro India pvt. Ltd .Hope you are looking for Job Change.Here We have an opportunity with MNC Company,.Role: Senior React JS Developer.","JavaScript,native iOS, Android development,React assumptions,Sentry,Bitrise,App Center,Redux,ESLint,Jest,React Native Testing Library,Problem-solving approach"
React Native Developer,HomeDruid,"Mysore, Karnataka",590000,"Thorough understanding of React Native and its core principles- Strong proficiency in JavaScript, including DOM manipulation and the JavaScript object model.","JavaScript,native iOS, Android development,React assumptions,Sentry,Bitrise,App Center,Redux,ESLint,Jest,React Native Testing Library,Problem-solving approach"
Mobile App (React Native) Developer(1-4 yrs),Protos Healthcare Technologies,nan,560000,"Detailed knowledge of Native Android App/iOS app Development.Good hands on in React JS and Ionic Platform.Current Knowledge with latest technologies, styles…","JavaScript,native iOS, Android development,React assumptions,Sentry,Bitrise,App Center,Redux,ESLint,Jest,React Native Testing Library,Problem-solving approach"
HYBRID Mobile App Developer - Exp- 2 - 5 Years,MedRec Technologies,"Ahmedabad, Gujarat",590000,"Good understanding of Android design guidelines, SDK and excellent JavaScript skills.Hands on experience with Hybrid development - React Native, JSX, Redux,…","JavaScript,native iOS, Android development,React assumptions,Sentry,Bitrise,App Center,Redux,ESLint,Jest,React Native Testing Library,Problem-solving approach"
React Native Developer,CDK Global,"Noida, Uttar Pradesh",470000,"We are having urgent openings for a consultant role having strong experience in react, Node JS and AWS.Location Address: Pune, State of Mahārāshtra 610011…","JavaScript,native iOS, Android development,React assumptions,Sentry,Bitrise,App Center,Redux,ESLint,Jest,React Native Testing Library,Problem-solving approach"
Full stack developer,Lunavo Labs,"Mumbai, Maharashtra",590000,UI developers should be adept at Angular JS / Node.js / Material Design.We are looking for talented Javascript developer who want to join our engineering team…,"JavaScript,native iOS, Android development,React assumptions,Sentry,Bitrise,App Center,Redux,ESLint,Jest,React Native Testing Library,Problem-solving approach"
Full stack developer,DynPro India Private Limited,"Delhi, Delhi",590000,1.Minimum 5 years of strong real time experience in developing React JS based applications with Redux and/or iOS and Android native applications.,"JavaScript,native iOS, Android development,React assumptions,Sentry,Bitrise,App Center,Redux,ESLint,Jest,React Native Testing Library,Problem-solving approach"
Android Developer,CDK Global,"Bengaluru, Karnataka",560000,"Title is ""Senior Mobile Application Developer"" and would be part of the IT team in our company - Tara Blooms Private Limited.(to support both iOS and Android).","JavaScript,native iOS, Android development,React assumptions,Sentry,Bitrise,App Center,Redux,ESLint,Jest,React Native Testing Library,Problem-solving approach"
React Native Developer - immediate joiner,classpro,"Ahmedabad, Gujarat",450000,"We are having urgent openings for a consultant role having strong experience in react, Node JS and AWS.Location Address: Pune, State of Mahārāshtra 610011…","JavaScript,native iOS, Android development,React assumptions,Sentry,Bitrise,App Center,Redux,ESLint,Jest,React Native Testing Library,Problem-solving approach"
Full Stack Developer,Tenmiles Technologies Pvt. Ltd.,"Noida, Uttar Pradesh",530000,"Proven work experience from 1-4 years as a Mobile developer.Lunavo Labs* is a US-based remote software product experience company headquartered in SanDiego,…","JavaScript,native iOS, Android development,React assumptions,Sentry,Bitrise,App Center,Redux,ESLint,Jest,React Native Testing Library,Problem-solving approach"
Senior React Native Developer,Safaltek Software,"Ahmedabad, Gujarat",510000,"Additionally, a basic knowledge or understanding on web technologies like html5, css3, javascript along with any front-end frameworks like angular, react native…","JavaScript,native iOS, Android development,React assumptions,Sentry,Bitrise,App Center,Redux,ESLint,Jest,React Native Testing Library,Problem-solving approach"
IONIC Developer,Netism Soft Private Limited,"Trichur, Kerala",540000,"Design and develop mobile applications using React Native.NoSQL database Like Couchbase, MongoDB or Firebase.Job Types: Full-time, Part-time, Contract.","JavaScript,native iOS, Android development,React assumptions,Sentry,Bitrise,App Center,Redux,ESLint,Jest,React Native Testing Library,Problem-solving approach"
Full Stack Developer,Creative Thoughts Informatics,"Indore, Madhya Pradesh",570000,"Title is ""Senior Mobile Application Developer"" and would be part of the IT team in our company - Tara Blooms Private Limited.(to support both iOS and Android).","JavaScript,native iOS, Android development,React assumptions,Sentry,Bitrise,App Center,Redux,ESLint,Jest,React Native Testing Library,Problem-solving approach"
Full Stack Developer,Safaltek Software,"Coimbatore, Tamil Nadu",530000,Looking for immediate or Serving Candidate who can join within 15 days.We are Looking React Native Mobile App Developer (Android / iOS).,"JavaScript,native iOS, Android development,React assumptions,Sentry,Bitrise,App Center,Redux,ESLint,Jest,React Native Testing Library,Problem-solving approach"
iOS Developer,Giriraj Digital,"Madurai, Tamil Nadu",450000,"We are having urgent openings for a consultant role having strong experience in react, Node JS and AWS.Location Address: Pune, State of Mahārāshtra 610011…","JavaScript,native iOS, Android development,React assumptions,Sentry,Bitrise,App Center,Redux,ESLint,Jest,React Native Testing Library,Problem-solving approach"
React Native Developer,Shenll Technology Solutions,"Hyderabad, Telangana",500000,Good understanding of React Native framework with min. 2 years of experience in React Native based application development..Good command on HTML5 and CSS.,"JavaScript,native iOS, Android development,React assumptions,Sentry,Bitrise,App Center,Redux,ESLint,Jest,React Native Testing Library,Problem-solving approach"
Mobile App (React Native) Developer(1-4 yrs),DiGiAssure,nan,470000,"Ability to create, develop & maintain React & React native application.Develop a flexible and well-structured front-end architecture.3rd floor, Plot No. 22,.","JavaScript,native iOS, Android development,React assumptions,Sentry,Bitrise,App Center,Redux,ESLint,Jest,React Native Testing Library,Problem-solving approach"
React Native Developer,classpro,"Calicut, Kerala",590000,Team up with peer developers and write good ObjectiveC / Swift code to implement & release features.We are looking for an experienced iOS developer with an eye…,"JavaScript,native iOS, Android development,React assumptions,Sentry,Bitrise,App Center,Redux,ESLint,Jest,React Native Testing Library,Problem-solving approach"
Full Stack Developer,MedRec Technologies,"Ramnathpara, Gujarat",560000,"Ability to create, develop & maintain React & React native application.Develop a flexible and well-structured front-end architecture.3rd floor, Plot No. 22,.","JavaScript,native iOS, Android development,React assumptions,Sentry,Bitrise,App Center,Redux,ESLint,Jest,React Native Testing Library,Problem-solving approach"
React Developer,Sunshine Creative Labs,"Una, Gujarat",450000,"Ability to create, develop & maintain React & React native application.Develop a flexible and well-structured front-end architecture.3rd floor, Plot No. 22,.","JavaScript,native iOS, Android development,React assumptions,Sentry,Bitrise,App Center,Redux,ESLint,Jest,React Native Testing Library,Problem-solving approach"
Senior Front-end Engineer [ UI ],Novaya,"Chennai, Tamil Nadu",450000,UI developers should be adept at Angular JS / Node.js / Material Design.We are looking for talented Javascript developer who want to join our engineering team…,"JavaScript,native iOS, Android development,React assumptions,Sentry,Bitrise,App Center,Redux,ESLint,Jest,React Native Testing Library,Problem-solving approach"
React Native Developer,HandBuiltApps,nan,450000,"Proven work experience from 1-4 years as a Mobile developer.Lunavo Labs* is a US-based remote software product experience company headquartered in SanDiego,…","JavaScript,native iOS, Android development,React assumptions,Sentry,Bitrise,App Center,Redux,ESLint,Jest,React Native Testing Library,Problem-solving approach"
React Native Developer,CDK Global,nan,460000,Working with the developers to create and maintain a robust framework to support the apps.Hands on experience with React Native is required.,"JavaScript,native iOS, Android development,React assumptions,Sentry,Bitrise,App Center,Redux,ESLint,Jest,React Native Testing Library,Problem-solving approach"
iOS Developer,Protos Healthcare Technologies,"Bengaluru, Karnataka",500000,"We are looking for an experienced Node, React and React Native developer to grow with our team with 1-2 years of experience.Js and other programming languages.","JavaScript,native iOS, Android development,React assumptions,Sentry,Bitrise,App Center,Redux,ESLint,Jest,React Native Testing Library,Problem-solving approach"
Full stack developer,IndiaNIC,nan,460000,Working with the developers to create and maintain a robust framework to support the apps.Hands on experience with React Native is required.,"JavaScript,native iOS, Android development,React assumptions,Sentry,Bitrise,App Center,Redux,ESLint,Jest,React Native Testing Library,Problem-solving approach"
Full Stack Developer,Shenll Technology Solutions,"Gurgaon, Haryana",450000,Urgent requirement for React Nagative App developer as a freelancer.Candidate should have 5+ years of experience and we will pay 160rs/hour.,"JavaScript,native iOS, Android development,React assumptions,Sentry,Bitrise,App Center,Redux,ESLint,Jest,React Native Testing Library,Problem-solving approach"
React Native Mobile developer,Lunavo Labs,"Coimbatore, Tamil Nadu",590000,On a day to do basis you will be writing your own code as well as modify the code of other developers to meet client requirements.,"JavaScript,native iOS, Android development,React assumptions,Sentry,Bitrise,App Center,Redux,ESLint,Jest,React Native Testing Library,Problem-solving approach"
Software Developer,CDK Global,"Bengaluru, Karnataka",500000,"Writes robust logical documentation that assists other developers.Design, implement, test and maintain node.js react application software.","JavaScript,native iOS, Android development,React assumptions,Sentry,Bitrise,App Center,Redux,ESLint,Jest,React Native Testing Library,Problem-solving approach"
React Native/Ionic Developer Mobile,I-Pangram Digital Service LLP(Fromally Jack Soluti...,"Bengaluru, Karnataka",450000,Good understanding of React Native framework with min. 2 years of experience in React Native based application development..Good command on HTML5 and CSS.,"JavaScript,native iOS, Android development,React assumptions,Sentry,Bitrise,App Center,Redux,ESLint,Jest,React Native Testing Library,Problem-solving approach"
Mobile App (React Native) Developer(1-4 yrs),DiGiAssure,"Noida, Uttar Pradesh",580000,"React native development: 2 years (Required).Leverage native APIs for deep integrations with both platforms.Ability to write well-documented, clean code.","JavaScript,native iOS, Android development,React assumptions,Sentry,Bitrise,App Center,Redux,ESLint,Jest,React Native Testing Library,Problem-solving approach"
Senior React Native Developer,Talent Zone Consultants,"Ramnathpara, Gujarat",460000,Have at least 2+ years of experience in react native development (Mandatory).Integrating and building native plugins.Job Code:RNDEV Key Skills:,"JavaScript,native iOS, Android development,React assumptions,Sentry,Bitrise,App Center,Redux,ESLint,Jest,React Native Testing Library,Problem-solving approach"
Full Stack Developer,Lunavo Labs,"Kalignar Karunanidhinagar, Tamil Nadu",510000,"Leverage native APIs for deep integrations with both platforms.Familiarity with native build tools, like XCode, Android Studio.","JavaScript,native iOS, Android development,React assumptions,Sentry,Bitrise,App Center,Redux,ESLint,Jest,React Native Testing Library,Problem-solving approach"
Android Developer,Forpets Services,"Coimbatore, Tamil Nadu",580000,"We are having urgent openings for a consultant role having strong experience in react, Node JS and AWS.Location Address: Pune, State of Mahārāshtra 610011…","JavaScript,native iOS, Android development,React assumptions,Sentry,Bitrise,App Center,Redux,ESLint,Jest,React Native Testing Library,Problem-solving approach"
