Job_Name,Company_Name,Location,Salary,Description,Skills
 JavaScript / React Native / Redux Developer,classpro,"Mumbai, Maharashtra",NA,We are looking for talented Javascript developer who want to join our engineering team to build great application for Education domain.,"JavaScript,native iOS, Android development,React assumptions,Sentry,Bitrise,App Center,Redux,ESLint,Jest,React Native Testing Library,Problem-solving approach"
React.js Developer,Ajackus,"Mumbai, Maharashtra",400000 - 1200000,Mumbai3 - 12 years₹4L - ₹12L / yr (ESOP available).We are looking for a React Developer to join our awesome team and deliver a streamlined user experience.,"JavaScript,native iOS, Android development,React assumptions,Sentry,Bitrise,App Center,Redux,ESLint,Jest,React Native Testing Library,Problem-solving approach"
React Native Developer (Immediate joiners preferred),shree,"Delhi, Delhi",300000 - 480000,React native : 1 year (Preferred).React native: 1 year (Preferred).Collected from earlier answers and listed as part of your job description.,"JavaScript,native iOS, Android development,React assumptions,Sentry,Bitrise,App Center,Redux,ESLint,Jest,React Native Testing Library,Problem-solving approach"
React Native Developer,Root Info Solution,"New Delhi, Delhi",NA,"Key Skills: - Redux, HTML, CSS, react native, javascript .Leverage native APIs for deep integrations with both platforms.Job Role: - React Native Developer.","JavaScript,native iOS, Android development,React assumptions,Sentry,Bitrise,App Center,Redux,ESLint,Jest,React Native Testing Library,Problem-solving approach"
React Native Developer,Forpets Services,"Chennai, Tamil Nadu",350000 - 500000,Should have knowledge in native APIs.Forpets is a pet-tech startup in Chennai.We are looking for tech-enthusiasts who can provide their extraordinary skills…,"JavaScript,native iOS, Android development,React assumptions,Sentry,Bitrise,App Center,Redux,ESLint,Jest,React Native Testing Library,Problem-solving approach"
React Native Developer,Twin Labs,"Chandigarh, Chandigarh",NA,Leverage native APIs for deep integrations with both platforms.Diagnose and fix bugs and performance bottlenecks for performance that feels native.,"JavaScript,native iOS, Android development,React assumptions,Sentry,Bitrise,App Center,Redux,ESLint,Jest,React Native Testing Library,Problem-solving approach"
React Native Developer - immediate joiner,Pentoz Technology,"Chennai, Tamil Nadu",15000 - 35000,"Experience with React Js, React Native, JavaScript including DOM Manipulation and tha JavaScript object model.\* Good Knowledge of HTML5, CSS.","JavaScript,native iOS, Android development,React assumptions,Sentry,Bitrise,App Center,Redux,ESLint,Jest,React Native Testing Library,Problem-solving approach"
React Native Developer,MedRec Technologies,"Mumbai, Maharashtra",NA,"Prior experience with native Mobile Application Development for iPhone and Android using (Objective-C and Swift, or Java).Experience with User Data Security.","JavaScript,native iOS, Android development,React assumptions,Sentry,Bitrise,App Center,Redux,ESLint,Jest,React Native Testing Library,Problem-solving approach"
React Native Developer,HashStudioz,"Noida, Uttar Pradesh",400000 - 700000,Work with native modules when required.2+ years of professional experience working with React Native as well as professional software development.,"JavaScript,native iOS, Android development,React assumptions,Sentry,Bitrise,App Center,Redux,ESLint,Jest,React Native Testing Library,Problem-solving approach"
React Native Developer,Creative Thoughts Informatics,"Indore, Madhya Pradesh",NA,"Work with native modules when required.Implement clean, modern, smooth animations and transitions that provide an excellent user experience.","JavaScript,native iOS, Android development,React assumptions,Sentry,Bitrise,App Center,Redux,ESLint,Jest,React Native Testing Library,Problem-solving approach"
React Native App Developer,Sunshine Creative Labs,"Hyderabad, Telangana",160 - 180 an hour,Urgent requirement for React Nagative App developer as a freelancer.Candidate should have 5+ years of experience and we will pay 160rs/hour.,"JavaScript,native iOS, Android development,React assumptions,Sentry,Bitrise,App Center,Redux,ESLint,Jest,React Native Testing Library,Problem-solving approach"
React Native Mobile developer,az,NA,20000,"Design and develop mobile applications using React Native.NoSQL database Like Couchbase, MongoDB or Firebase.Job Types: Full-time, Part-time, Contract.","JavaScript,native iOS, Android development,React assumptions,Sentry,Bitrise,App Center,Redux,ESLint,Jest,React Native Testing Library,Problem-solving approach"
React Native developer,Sumanas Technologies,"Madurai, Tamil Nadu",NA,Leverage native APIs for deep integrations with both platforms.Diagnose and fix bugs and performance bottlenecks for performance that feels native.,"JavaScript,native iOS, Android development,React assumptions,Sentry,Bitrise,App Center,Redux,ESLint,Jest,React Native Testing Library,Problem-solving approach"
React Native Mobile App Developer,Netism Soft Private Limited,"Chromepet, Chennai, Tamil Nadu",15000 - 20000,Cross-platform mobile app developers who have developed mobile apps with a familiarity of React Native.Need to join immediately and start to work from home…,"JavaScript,native iOS, Android development,React assumptions,Sentry,Bitrise,App Center,Redux,ESLint,Jest,React Native Testing Library,Problem-solving approach"
React Native Developer,Appbylogic,"Calicut, Kerala",NA,"Minimum 4 years of experience in building large scale mobiles apps using React Native.Architect, build, and maintain excellent React Native applications with…","JavaScript,native iOS, Android development,React assumptions,Sentry,Bitrise,App Center,Redux,ESLint,Jest,React Native Testing Library,Problem-solving approach"
React Native Developer,"One Click IT Solutions, Ahmedabad","Ahmedabad, Gujarat",250000 - 600000,"Work with native modules when required.Work as part of a small team, which will include other React Native developers, a project manager, QA professional, and…","JavaScript,native iOS, Android development,React assumptions,Sentry,Bitrise,App Center,Redux,ESLint,Jest,React Native Testing Library,Problem-solving approach"
React Developer,Protos Healthcare Technologies,NA,200000 - 450000,"Ability to create, develop & maintain React & React native application.Develop a flexible and well-structured front-end architecture.3rd floor, Plot No. 22,.","JavaScript,native iOS, Android development,React assumptions,Sentry,Bitrise,App Center,Redux,ESLint,Jest,React Native Testing Library,Problem-solving approach"
React Native Developer,Mobiweb Global Solutions,"New Delhi, Delhi",5000 - 15000,Good understanding of React Native framework with min. 2 years of experience in React Native based application development..Good command on HTML5 and CSS.,"JavaScript,native iOS, Android development,React assumptions,Sentry,Bitrise,App Center,Redux,ESLint,Jest,React Native Testing Library,Problem-solving approach"
React Native Developer,Appxerbia Software Solutions,"Pune, Maharashtra",20000 - 30000,"React native development: 2 years (Required).Leverage native APIs for deep integrations with both platforms.Ability to write well-documented, clean code.","JavaScript,native iOS, Android development,React assumptions,Sentry,Bitrise,App Center,Redux,ESLint,Jest,React Native Testing Library,Problem-solving approach"
React Native Mobile App Developer,Imperial IT Pvt Ltd,"Noida, Uttar Pradesh",600000 - 800000,Looking for immediate or Serving Candidate who can join within 15 days.We are Looking React Native Mobile App Developer (Android / iOS).,"JavaScript,native iOS, Android development,React assumptions,Sentry,Bitrise,App Center,Redux,ESLint,Jest,React Native Testing Library,Problem-solving approach"
React Native Developer,Shenll Technology Solutions,"Kalignar Karunanidhinagar, Tamil Nadu",400000 - 500000,"Thorough understanding of React Native and its core principles- Strong proficiency in JavaScript, including DOM manipulation and the JavaScript object model.","JavaScript,native iOS, Android development,React assumptions,Sentry,Bitrise,App Center,Redux,ESLint,Jest,React Native Testing Library,Problem-solving approach"
React Developer,Protos Healthcare Technologies,NA,200000 - 450000,"Ability to create, develop & maintain React & React native application.Develop a flexible and well-structured front-end architecture.3rd floor, Plot No. 22,.","JavaScript,native iOS, Android development,React assumptions,Sentry,Bitrise,App Center,Redux,ESLint,Jest,React Native Testing Library,Problem-solving approach"
React Native Developer,Novaya,"Hyderabad, Telangana",NA,"Leverage native APIs for deep integrations with both platforms.Familiarity with native build tools, like XCode, Android Studio.","JavaScript,native iOS, Android development,React assumptions,Sentry,Bitrise,App Center,Redux,ESLint,Jest,React Native Testing Library,Problem-solving approach"
React Native Developer,Gl Infotech,"Trichur, Kerala",35000 - 60000,"Full-time work experience in React Native or similar framework Proficient in React.Experience architecting and building commercial apps, released in both the…","JavaScript,native iOS, Android development,React assumptions,Sentry,Bitrise,App Center,Redux,ESLint,Jest,React Native Testing Library,Problem-solving approach"
Senior React Native Developer,MASS SOFTWARE SOLUTIONS,"New Town, Kolkata, West Bengal",NA,Have at least 2+ years of experience in react native development (Mandatory).Integrating and building native plugins.Job Code:RNDEV Key Skills:,"JavaScript,native iOS, Android development,React assumptions,Sentry,Bitrise,App Center,Redux,ESLint,Jest,React Native Testing Library,Problem-solving approach"
Mobile Application Developer - React Native,Ascendz HR Solutions,"Bengaluru, Karnataka",1500000 - 2500000,"Actively participate in code/design reviews with fellow mobile app developers.Understanding of Android/iOS internals, native APIs, push notifications,…","JavaScript,native iOS, Android development,React assumptions,Sentry,Bitrise,App Center,Redux,ESLint,Jest,React Native Testing Library,Problem-solving approach"
React Native Developer/Mobile app.developer/ Nodejs /Reactjs...,I-Pangram Digital Service LLP(Fromally Jack Soluti...,"Surat, Gujarat",10000 - 30000,"I-pangram (Formally Jack Solutions) was founded in the year 2008, a web development company having enriched experience in the IT business and website…","JavaScript,native iOS, Android development,React assumptions,Sentry,Bitrise,App Center,Redux,ESLint,Jest,React Native Testing Library,Problem-solving approach"
React Native Developer,Safaltek Software,"Mohali, Punjab",NA,"Urgent Hiring for React\_Native\_Developer..!!Ø Strong proficiency in React Native.Ø Experiencewith Swift, Objective-C or Java.#Experience* : 2 to 4 years.","JavaScript,native iOS, Android development,React assumptions,Sentry,Bitrise,App Center,Redux,ESLint,Jest,React Native Testing Library,Problem-solving approach"
Mobile Developer_React Native,Deven InfoTech,"Pune, Maharashtra",NA,"Skill: Angular, rest api, Android Development, web api, typescript, react native.Excellent written, verbal communication and customer interfacing skills.","JavaScript,native iOS, Android development,React assumptions,Sentry,Bitrise,App Center,Redux,ESLint,Jest,React Native Testing Library,Problem-solving approach"
React Native Developer,ENGINEERS PASSION SOFTWARE PRIVATE LIMITED,"Noida, Uttar Pradesh",30000 - 40000,"We are looking for an experienced Node, React and React Native developer to grow with our team with 1-2 years of experience.Js and other programming languages.","JavaScript,native iOS, Android development,React assumptions,Sentry,Bitrise,App Center,Redux,ESLint,Jest,React Native Testing Library,Problem-solving approach"
React Developer,Protos Healthcare Technologies,NA,200000 - 450000,"Ability to create, develop & maintain React & React native application.Develop a flexible and well-structured front-end architecture.3rd floor, Plot No. 22,.","JavaScript,native iOS, Android development,React assumptions,Sentry,Bitrise,App Center,Redux,ESLint,Jest,React Native Testing Library,Problem-solving approach"
React Developer,Protos Healthcare Technologies,NA,200000 - 450000,"Ability to create, develop & maintain React & React native application.Develop a flexible and well-structured front-end architecture.3rd floor, Plot No. 22,.","JavaScript,native iOS, Android development,React assumptions,Sentry,Bitrise,App Center,Redux,ESLint,Jest,React Native Testing Library,Problem-solving approach"
React Developer,Protos Healthcare Technologies,NA,200000 - 450000,"Ability to create, develop & maintain React & React native application.Develop a flexible and well-structured front-end architecture.3rd floor, Plot No. 22,.","JavaScript,native iOS, Android development,React assumptions,Sentry,Bitrise,App Center,Redux,ESLint,Jest,React Native Testing Library,Problem-solving approach"
Mobile Developer (React Native),Bagmo Pvt Ltd,"Kochi, Kerala",20000 - 30000,Developing new user-facing features using React.js.Building reusable components and front-end libraries for future use.React Native: 1 year (Preferred).,"JavaScript,native iOS, Android development,React assumptions,Sentry,Bitrise,App Center,Redux,ESLint,Jest,React Native Testing Library,Problem-solving approach"
React Native Developer,56N Software Pvt Ltd,"Ahmedabad, Gujarat",360000,Leverage native APIs for deep integrations with both platforms.Experience in developing apps on native Android/iOS platform will be additional.,"JavaScript,native iOS, Android development,React assumptions,Sentry,Bitrise,App Center,Redux,ESLint,Jest,React Native Testing Library,Problem-solving approach"
Android Developer,HELYXON Healthcare Solutions,"Chennai, Tamil Nadu",400000,1 year of hands-on experience building native Android apps.Design and build advanced applications for android platform.Experience with SOAP/REST web services.,"JavaScript,native iOS, Android development,React assumptions,Sentry,Bitrise,App Center,Redux,ESLint,Jest,React Native Testing Library,Problem-solving approach"
Senior Software Developer,Planys Technologies,"Chennai, Tamil Nadu",1000000 - 1500000,"Additionally, a basic knowledge or understanding on web technologies like html5, css3, javascript along with any front-end frameworks like angular, react native…","JavaScript,native iOS, Android development,React assumptions,Sentry,Bitrise,App Center,Redux,ESLint,Jest,React Native Testing Library,Problem-solving approach"
React Native developer,mplussoft,"Pune, Maharashtra",NA,Leverage native APIs for deep integrations with both platforms.Diagnose and fix bugs and performance bottlenecks for performance that feels native.,"JavaScript,native iOS, Android development,React assumptions,Sentry,Bitrise,App Center,Redux,ESLint,Jest,React Native Testing Library,Problem-solving approach"
React JS Developer,DynPro India Private Limited,"Gurgaon, Haryana",600000 - 1000000,"Greetings from Dynpro India pvt. Ltd .Hope you are looking for Job Change.Here We have an opportunity with MNC Company,.Role: Senior React JS Developer.","JavaScript,native iOS, Android development,React assumptions,Sentry,Bitrise,App Center,Redux,ESLint,Jest,React Native Testing Library,Problem-solving approach"
Android Developer,Click2Cloud,India,NA,"Knowledge of Flutter or React-native will be an advantage.Exp. Level 02-05 Years.Strong technical expertise on the Android device platform, exposure to custom…","JavaScript,native iOS, Android development,React assumptions,Sentry,Bitrise,App Center,Redux,ESLint,Jest,React Native Testing Library,Problem-solving approach"
React Native/Ionic Developer Mobile,Alliance Tech,Madhya Pradesh,NA,"Exposure to native Android / iOS framework, Working experience in Web Service and REST API integration.Experience of mobile application development using…","JavaScript,native iOS, Android development,React assumptions,Sentry,Bitrise,App Center,Redux,ESLint,Jest,React Native Testing Library,Problem-solving approach"
Junior Developer,DiGiAssure,"Ahmedabad, Gujarat",20000 - 50000,"Writes robust logical documentation that assists other developers.Design, implement, test and maintain node.js react application software.","JavaScript,native iOS, Android development,React assumptions,Sentry,Bitrise,App Center,Redux,ESLint,Jest,React Native Testing Library,Problem-solving approach"
Flutter Developer,Latlon Technologies,"Coimbatore, Tamil Nadu",NA,"Expert in Dart, with strong knowledge of any other native or cross platform mobile development framework (Swift iOS, Java Android, React Native).","JavaScript,native iOS, Android development,React assumptions,Sentry,Bitrise,App Center,Redux,ESLint,Jest,React Native Testing Library,Problem-solving approach"
Mobile App Developer,Protea Infotech,"Ramnathpara, Gujarat",NA,"Detailed knowledge of Native Android App/iOS app Development.Good hands on in React JS and Ionic Platform.Current Knowledge with latest technologies, styles…","JavaScript,native iOS, Android development,React assumptions,Sentry,Bitrise,App Center,Redux,ESLint,Jest,React Native Testing Library,Problem-solving approach"
React Native Developer,Smartgen Technologies Pvt. Ltd.,"Visakhapatnam, Andhra Pradesh",NA,1.Must have experience in either android app or iOS app development.2.At least 2 years of experience in React Native app development.,"JavaScript,native iOS, Android development,React assumptions,Sentry,Bitrise,App Center,Redux,ESLint,Jest,React Native Testing Library,Problem-solving approach"
"Full Stack Developer FED - NODE JS, React Native",Zensar Technologies,"Bengaluru, Karnataka",NA,"Services using other tech stacks can be mixed inReact (web) + React Native (native apps).Full Stack Developer FED - NODE JS, React Native - (0057211).","JavaScript,native iOS, Android development,React assumptions,Sentry,Bitrise,App Center,Redux,ESLint,Jest,React Native Testing Library,Problem-solving approach"
React Native Developer,Giriraj Digital,"Ahmedabad, Gujarat",NA,Working with the developers to create and maintain a robust framework to support the apps.Hands on experience with React Native is required.,"JavaScript,native iOS, Android development,React assumptions,Sentry,Bitrise,App Center,Redux,ESLint,Jest,React Native Testing Library,Problem-solving approach"
Senior Frontend Developer,SignEasy,"Bengaluru, Karnataka",NA,"Work closely with cross-functional teams of product manager, backend developers, and UI/UX designers.We are looking for a Senior Frontend developer who is…","JavaScript,native iOS, Android development,React assumptions,Sentry,Bitrise,App Center,Redux,ESLint,Jest,React Native Testing Library,Problem-solving approach"
React Native Mobile Application Developers,WebWings Global Solutions,"Bengaluru, Karnataka",NA,Strong background and hands on experience in working with React native mobile applications.We are looking to hire React Native mobile application developers…,"JavaScript,native iOS, Android development,React assumptions,Sentry,Bitrise,App Center,Redux,ESLint,Jest,React Native Testing Library,Problem-solving approach"
React Native Architect/Mumbai,Talent Zone Consultants,"Mumbai, Maharashtra",400000 - 750000,1.Minimum 5 years of strong real time experience in developing React JS based applications with Redux and/or iOS and Android native applications.,"JavaScript,native iOS, Android development,React assumptions,Sentry,Bitrise,App Center,Redux,ESLint,Jest,React Native Testing Library,Problem-solving approach"
Cloud-based Application Developer using React,Manipal Dot Net,"Manipala, Karnataka",NA,"Manipal Dot Net is looking for an experienced Software Engineer to work on Cloud-based Server and client side Application using React, React Native and Kotlin.","JavaScript,native iOS, Android development,React assumptions,Sentry,Bitrise,App Center,Redux,ESLint,Jest,React Native Testing Library,Problem-solving approach"
iOS Developer,EnLume,"Hyderabad, Telangana",NA,"Design, Build and maintain applications for the iOS platform.App Integrations with back-end Services.Ensure App Performance, Responsiveness and Good Quality…","JavaScript,native iOS, Android development,React assumptions,Sentry,Bitrise,App Center,Redux,ESLint,Jest,React Native Testing Library,Problem-solving approach"
Mobile App Developer,Tara Blooms,"Coimbatore, Tamil Nadu",20000 - 40000,"Title is ""Senior Mobile Application Developer"" and would be part of the IT team in our company - Tara Blooms Private Limited.(to support both iOS and Android).","JavaScript,native iOS, Android development,React assumptions,Sentry,Bitrise,App Center,Redux,ESLint,Jest,React Native Testing Library,Problem-solving approach"
IOS Developer,Zencode,"Chennai, Tamil Nadu",NA,"4+ years experience developing mobile app using Swift.Demonstrated expertise with Apple's iOS SDK (Cocoa, Cocoa Touch, etc.).","JavaScript,native iOS, Android development,React assumptions,Sentry,Bitrise,App Center,Redux,ESLint,Jest,React Native Testing Library,Problem-solving approach"
Android Developer,Star Knowledge,"Mysore, Karnataka",NA,"Looking for Android developers to develop/enhance our Android app.Qualification: Graduate, Post Graduate, Engineering.Develop and Improve Android App UI/UX.","JavaScript,native iOS, Android development,React assumptions,Sentry,Bitrise,App Center,Redux,ESLint,Jest,React Native Testing Library,Problem-solving approach"
Mobile App Developer,HandBuiltApps,"Sivakasi, Tamil Nadu",15000 - 30000,On a day to do basis you will be writing your own code as well as modify the code of other developers to meet client requirements.,"JavaScript,native iOS, Android development,React assumptions,Sentry,Bitrise,App Center,Redux,ESLint,Jest,React Native Testing Library,Problem-solving approach"
HYBRID Mobile App Developer - Exp- 2 - 5 Years,Cruzze Solutions LLP,"Coimbatore, Tamil Nadu",200000 - 600000,"We are looking for a Hybrid Mobile App Developer.Proficient with Flutter or React Native.Proficient with HTML5/CSS3, JavaScript, Angular JS.","JavaScript,native iOS, Android development,React assumptions,Sentry,Bitrise,App Center,Redux,ESLint,Jest,React Native Testing Library,Problem-solving approach"
Senior Front-end Engineer [ UI ],ABCPQR,"Mumbai, Maharashtra",NA,UI developers should be adept at Angular JS / Node.js / Material Design.We are looking for talented Javascript developer who want to join our engineering team…,"JavaScript,native iOS, Android development,React assumptions,Sentry,Bitrise,App Center,Redux,ESLint,Jest,React Native Testing Library,Problem-solving approach"
iOS Developer,BaffleSol Technologies,"Gurgaon, Haryana",NA,"Minimum 2-5 years of experience in developing iOS app.Proficient with the languages, tools, and frameworks core to iOS development, including Objective-C,…","JavaScript,native iOS, Android development,React assumptions,Sentry,Bitrise,App Center,Redux,ESLint,Jest,React Native Testing Library,Problem-solving approach"
Key Skills for Remote React Native Developer Jobs,Spotinjob,"Una, Gujarat",NA,">Understanding of native build tools like Xcode, Gradle, etc.>Capability to take advantage of native APIs for deep integration of all platforms.","JavaScript,native iOS, Android development,React assumptions,Sentry,Bitrise,App Center,Redux,ESLint,Jest,React Native Testing Library,Problem-solving approach"
Android Developer,Place1India,"Ahmedabad, Gujarat",20000 - 40000,"Java (Kotlin and React native experiece is plus).Latest hiring for Android developer in Ahmedabad, Android Application Developer Job vacancies in Ahmedabad.","JavaScript,native iOS, Android development,React assumptions,Sentry,Bitrise,App Center,Redux,ESLint,Jest,React Native Testing Library,Problem-solving approach"
JavaScript Developer,Bloom Consulting Services,"Nagpur, Maharashtra",NA,"Good understanding of Android design guidelines, SDK and excellent JavaScript skills.Hands on experience with Hybrid development - React Native, JSX, Redux,…","JavaScript,native iOS, Android development,React assumptions,Sentry,Bitrise,App Center,Redux,ESLint,Jest,React Native Testing Library,Problem-solving approach"
Software Developer,Borgos Technologies,"Bengaluru, Karnataka",NA,Experience developing hybrid native/HTML mobile applications.Develop high quality maintainable code.Execute projects and develop against an outlined design.,"JavaScript,native iOS, Android development,React assumptions,Sentry,Bitrise,App Center,Redux,ESLint,Jest,React Native Testing Library,Problem-solving approach"
IONIC Developer,IndiaNIC,"Ahmedabad, Gujarat",NA,"Good skill in Cordova or PhoneGap.Must have knowledge of Ionic 2-3, Angular 2-4, UI with Angular, CSS3, HTML 5, angular material.Experience: 1 to 5 Years.","JavaScript,native iOS, Android development,React assumptions,Sentry,Bitrise,App Center,Redux,ESLint,Jest,React Native Testing Library,Problem-solving approach"
Full stack developer,HomeDruid,"Bengaluru, Karnataka",NA,"The success and culture of a company is greatly driven by the initial set of folks, so we're looking for smart developers who are very passionate about the…","JavaScript,native iOS, Android development,React assumptions,Sentry,Bitrise,App Center,Redux,ESLint,Jest,React Native Testing Library,Problem-solving approach"
Mobile App (React Native) Developer(1-4 yrs),Lunavo Labs,NA,20000 - 45000,"Proven work experience from 1-4 years as a Mobile developer.Lunavo Labs* is a US-based remote software product experience company headquartered in SanDiego,…","JavaScript,native iOS, Android development,React assumptions,Sentry,Bitrise,App Center,Redux,ESLint,Jest,React Native Testing Library,Problem-solving approach"
