Job_Name,Company_Name,Location,Salary,Description,Skills
React Native Mobile developer,Alliance Tech,nan,460000,"We are having urgent openings for a consultant role having strong experience in react, Node JS and AWS.Location Address: Pune, State of Mahārāshtra 610011…","JavaScript,native iOS, Android development,React assumptions,Sentry,Bitrise,App Center,Redux,ESLint,Jest,React Native Testing Library,Problem-solving approach"
React Native/Ionic Developer Mobile,BaffleSol Technologies,"Ahmedabad, Gujarat",580000,"Work with native modules when required.Implement clean, modern, smooth animations and transitions that provide an excellent user experience.","JavaScript,native iOS, Android development,React assumptions,Sentry,Bitrise,App Center,Redux,ESLint,Jest,React Native Testing Library,Problem-solving approach"
React Native Developer,CDK Global,"Madurai, Tamil Nadu",510000,"Services using other tech stacks can be mixed inReact (web) + React Native (native apps).Full Stack Developer FED - NODE JS, React Native - (0057211).","JavaScript,native iOS, Android development,React assumptions,Sentry,Bitrise,App Center,Redux,ESLint,Jest,React Native Testing Library,Problem-solving approach"
React Developer,"One Click IT Solutions, Ahmedabad",nan,590000,"We are having urgent openings for a consultant role having strong experience in react, Node JS and AWS.Location Address: Pune, State of Mahārāshtra 610011…","JavaScript,native iOS, Android development,React assumptions,Sentry,Bitrise,App Center,Redux,ESLint,Jest,React Native Testing Library,Problem-solving approach"
React Native Developer - immediate joiner,Gl Infotech,nan,510000,Cross-platform mobile app developers who have developed mobile apps with a familiarity of React Native.Need to join immediately and start to work from home…,"JavaScript,native iOS, Android development,React assumptions,Sentry,Bitrise,App Center,Redux,ESLint,Jest,React Native Testing Library,Problem-solving approach"
React Native Developer,Cruzze Solutions LLP,"New Delhi, Delhi",580000,On a day to do basis you will be writing your own code as well as modify the code of other developers to meet client requirements.,"JavaScript,native iOS, Android development,React assumptions,Sentry,Bitrise,App Center,Redux,ESLint,Jest,React Native Testing Library,Problem-solving approach"
React Native Developer,mplussoft,"Ahmedabad, Gujarat",550000,"Proven work experience from 1-4 years as a Mobile developer.Lunavo Labs* is a US-based remote software product experience company headquartered in SanDiego,…","JavaScript,native iOS, Android development,React assumptions,Sentry,Bitrise,App Center,Redux,ESLint,Jest,React Native Testing Library,Problem-solving approach"
Full Stack Developer,CDK Global,"Coimbatore, Tamil Nadu",550000,"The success and culture of a company is greatly driven by the initial set of folks, so we're looking for smart developers who are very passionate about the…","JavaScript,native iOS, Android development,React assumptions,Sentry,Bitrise,App Center,Redux,ESLint,Jest,React Native Testing Library,Problem-solving approach"
Full Stack Developer,Star Knowledge,nan,550000,"Ability to create, develop & maintain React & React native application.Develop a flexible and well-structured front-end architecture.3rd floor, Plot No. 22,.","JavaScript,native iOS, Android development,React assumptions,Sentry,Bitrise,App Center,Redux,ESLint,Jest,React Native Testing Library,Problem-solving approach"
Mobile Application Developer - React Native,DiGiAssure,"Bengaluru, Karnataka",460000,"I-pangram (Formally Jack Solutions) was founded in the year 2008, a web development company having enriched experience in the IT business and website…","JavaScript,native iOS, Android development,React assumptions,Sentry,Bitrise,App Center,Redux,ESLint,Jest,React Native Testing Library,Problem-solving approach"
React Native Developer,Gl Infotech,nan,530000,"We are having urgent openings for a consultant role having strong experience in react, Node JS and AWS.Location Address: Pune, State of Mahārāshtra 610011…","JavaScript,native iOS, Android development,React assumptions,Sentry,Bitrise,App Center,Redux,ESLint,Jest,React Native Testing Library,Problem-solving approach"
Flutter Developer,HandBuiltApps,"New Town, Kolkata, West Bengal",560000,"Work with native modules when required.Implement clean, modern, smooth animations and transitions that provide an excellent user experience.","JavaScript,native iOS, Android development,React assumptions,Sentry,Bitrise,App Center,Redux,ESLint,Jest,React Native Testing Library,Problem-solving approach"
Senior Front-end Engineer [ UI ],DynPro India Private Limited,"Sivakasi, Tamil Nadu",460000,"Work closely with cross-functional teams of product manager, backend developers, and UI/UX designers.We are looking for a Senior Frontend developer who is…","JavaScript,native iOS, Android development,React assumptions,Sentry,Bitrise,App Center,Redux,ESLint,Jest,React Native Testing Library,Problem-solving approach"
React.js Developer,CDK Global,nan,500000,"We are having urgent openings for a consultant role having strong experience in react, Node JS and AWS.Location Address: Pune, State of Mahārāshtra 610011…","JavaScript,native iOS, Android development,React assumptions,Sentry,Bitrise,App Center,Redux,ESLint,Jest,React Native Testing Library,Problem-solving approach"
IOS Developer,CDK Global,nan,510000,"React native development: 2 years (Required).Leverage native APIs for deep integrations with both platforms.Ability to write well-documented, clean code.","JavaScript,native iOS, Android development,React assumptions,Sentry,Bitrise,App Center,Redux,ESLint,Jest,React Native Testing Library,Problem-solving approach"
iOS Developer,CDK Global,nan,510000,"Ability to create, develop & maintain React & React native application.Develop a flexible and well-structured front-end architecture.3rd floor, Plot No. 22,.","JavaScript,native iOS, Android development,React assumptions,Sentry,Bitrise,App Center,Redux,ESLint,Jest,React Native Testing Library,Problem-solving approach"
React Native Developer - immediate joiner,Smartgen Technologies Pvt. Ltd.,"Noida, Uttar Pradesh",510000,"We are having urgent openings for a consultant role having strong experience in react, Node JS and AWS.Location Address: Pune, State of Mahārāshtra 610011…","JavaScript,native iOS, Android development,React assumptions,Sentry,Bitrise,App Center,Redux,ESLint,Jest,React Native Testing Library,Problem-solving approach"
React Native Developer,Star Knowledge,"Calicut, Kerala",590000,"Design, Build and maintain applications for the iOS platform.App Integrations with back-end Services.Ensure App Performance, Responsiveness and Good Quality…","JavaScript,native iOS, Android development,React assumptions,Sentry,Bitrise,App Center,Redux,ESLint,Jest,React Native Testing Library,Problem-solving approach"
Senior Frontend Developer,Sunshine Creative Labs,"Noida, Uttar Pradesh",520000,Working with the developers to create and maintain a robust framework to support the apps.Hands on experience with React Native is required.,"JavaScript,native iOS, Android development,React assumptions,Sentry,Bitrise,App Center,Redux,ESLint,Jest,React Native Testing Library,Problem-solving approach"
Mobile Developer (React Native),"One Click IT Solutions, Ahmedabad",nan,500000,"Minimum 4 years of experience in building large scale mobiles apps using React Native.Architect, build, and maintain excellent React Native applications with…","JavaScript,native iOS, Android development,React assumptions,Sentry,Bitrise,App Center,Redux,ESLint,Jest,React Native Testing Library,Problem-solving approach"
Full Stack Developer,CDK Global,"Noida, Uttar Pradesh",470000,Mumbai3 - 12 years₹4L - ₹12L / yr (ESOP available).We are looking for a React Developer to join our awesome team and deliver a streamlined user experience.,"JavaScript,native iOS, Android development,React assumptions,Sentry,Bitrise,App Center,Redux,ESLint,Jest,React Native Testing Library,Problem-solving approach"
React Native Mobile developer,MedRec Technologies,"New Delhi, Delhi",470000,On a day to do basis you will be writing your own code as well as modify the code of other developers to meet client requirements.,"JavaScript,native iOS, Android development,React assumptions,Sentry,Bitrise,App Center,Redux,ESLint,Jest,React Native Testing Library,Problem-solving approach"
Mobile App (React Native) Developer(1-4 yrs),Sunshine Creative Labs,"New Delhi, Delhi",480000,"We are having urgent openings for a consultant role having strong experience in react, Node JS and AWS.Location Address: Pune, State of Mahārāshtra 610011…","JavaScript,native iOS, Android development,React assumptions,Sentry,Bitrise,App Center,Redux,ESLint,Jest,React Native Testing Library,Problem-solving approach"
React Developer,Tenmiles Technologies Pvt. Ltd.,"Bengaluru, Karnataka",520000,"Ability to create, develop & maintain React & React native application.Develop a flexible and well-structured front-end architecture.3rd floor, Plot No. 22,.","JavaScript,native iOS, Android development,React assumptions,Sentry,Bitrise,App Center,Redux,ESLint,Jest,React Native Testing Library,Problem-solving approach"
Full Stack Developer,Borgos Technologies,"Mumbai, Maharashtra",490000,Leverage native APIs for deep integrations with both platforms.Experience in developing apps on native Android/iOS platform will be additional.,"JavaScript,native iOS, Android development,React assumptions,Sentry,Bitrise,App Center,Redux,ESLint,Jest,React Native Testing Library,Problem-solving approach"
Junior Developer,Pentoz Technology,nan,590000,"Actively participate in code/design reviews with fellow mobile app developers.Understanding of Android/iOS internals, native APIs, push notifications,…","JavaScript,native iOS, Android development,React assumptions,Sentry,Bitrise,App Center,Redux,ESLint,Jest,React Native Testing Library,Problem-solving approach"
React Native Developer,56N Software Pvt Ltd,nan,540000,Looking for immediate or Serving Candidate who can join within 15 days.We are Looking React Native Mobile App Developer (Android / iOS).,"JavaScript,native iOS, Android development,React assumptions,Sentry,Bitrise,App Center,Redux,ESLint,Jest,React Native Testing Library,Problem-solving approach"
Full Stack Developer,Zencode,"Coimbatore, Tamil Nadu",560000,"We are having urgent openings for a consultant role having strong experience in react, Node JS and AWS.Location Address: Pune, State of Mahārāshtra 610011…","JavaScript,native iOS, Android development,React assumptions,Sentry,Bitrise,App Center,Redux,ESLint,Jest,React Native Testing Library,Problem-solving approach"
Full Stack Developer,I-Pangram Digital Service LLP(Fromally Jack Soluti...,nan,470000,"We are having urgent openings for a consultant role having strong experience in react, Node JS and AWS.Location Address: Pune, State of Mahārāshtra 610011…","JavaScript,native iOS, Android development,React assumptions,Sentry,Bitrise,App Center,Redux,ESLint,Jest,React Native Testing Library,Problem-solving approach"
React Native Developer,Cruzze Solutions LLP,"New Town, Kolkata, West Bengal",570000,"Exposure to native Android / iOS framework, Working experience in Web Service and REST API integration.Experience of mobile application development using…","JavaScript,native iOS, Android development,React assumptions,Sentry,Bitrise,App Center,Redux,ESLint,Jest,React Native Testing Library,Problem-solving approach"
"Full Stack Developer FED - NODE JS, React Native",Borgos Technologies,nan,530000,"Prior experience with native Mobile Application Development for iPhone and Android using (Objective-C and Swift, or Java).Experience with User Data Security.","JavaScript,native iOS, Android development,React assumptions,Sentry,Bitrise,App Center,Redux,ESLint,Jest,React Native Testing Library,Problem-solving approach"
React Native Mobile Application Developers,Place1India,"Mumbai, Maharashtra",490000,"Ability to create, develop & maintain React & React native application.Develop a flexible and well-structured front-end architecture.3rd floor, Plot No. 22,.","JavaScript,native iOS, Android development,React assumptions,Sentry,Bitrise,App Center,Redux,ESLint,Jest,React Native Testing Library,Problem-solving approach"
React Native developer,CDK Global,"Bengaluru, Karnataka",490000,"Key Skills: - Redux, HTML, CSS, react native, javascript .Leverage native APIs for deep integrations with both platforms.Job Role: - React Native Developer.","JavaScript,native iOS, Android development,React assumptions,Sentry,Bitrise,App Center,Redux,ESLint,Jest,React Native Testing Library,Problem-solving approach"
React Native Architect/Mumbai,Latlon Technologies,"Coimbatore, Tamil Nadu",550000,"We are looking for an experienced Node, React and React Native developer to grow with our team with 1-2 years of experience.Js and other programming languages.","JavaScript,native iOS, Android development,React assumptions,Sentry,Bitrise,App Center,Redux,ESLint,Jest,React Native Testing Library,Problem-solving approach"
React Native Architect/Mumbai,Protos Healthcare Technologies,"Chennai, Tamil Nadu",490000,"Ability to create, develop & maintain React & React native application.Develop a flexible and well-structured front-end architecture.3rd floor, Plot No. 22,.","JavaScript,native iOS, Android development,React assumptions,Sentry,Bitrise,App Center,Redux,ESLint,Jest,React Native Testing Library,Problem-solving approach"
Full Stack Developer,Protos Healthcare Technologies,"New Delhi, Delhi",460000,"React native development: 2 years (Required).Leverage native APIs for deep integrations with both platforms.Ability to write well-documented, clean code.","JavaScript,native iOS, Android development,React assumptions,Sentry,Bitrise,App Center,Redux,ESLint,Jest,React Native Testing Library,Problem-solving approach"
IOS Developer,Planys Technologies,nan,580000,"We are having urgent openings for a consultant role having strong experience in react, Node JS and AWS.Location Address: Pune, State of Mahārāshtra 610011…","JavaScript,native iOS, Android development,React assumptions,Sentry,Bitrise,App Center,Redux,ESLint,Jest,React Native Testing Library,Problem-solving approach"
Key Skills for Remote React Native Developer Jobs,MASS SOFTWARE SOLUTIONS,"Ahmedabad, Gujarat",560000,"Knowledge of Flutter or React-native will be an advantage.Exp. Level 02-05 Years.Strong technical expertise on the Android device platform, exposure to custom…","JavaScript,native iOS, Android development,React assumptions,Sentry,Bitrise,App Center,Redux,ESLint,Jest,React Native Testing Library,Problem-solving approach"
React.js Developer,IndiaNIC,nan,550000,"Ability to create, develop & maintain React & React native application.Develop a flexible and well-structured front-end architecture.3rd floor, Plot No. 22,.","JavaScript,native iOS, Android development,React assumptions,Sentry,Bitrise,App Center,Redux,ESLint,Jest,React Native Testing Library,Problem-solving approach"
React Native developer,Protos Healthcare Technologies,"Coimbatore, Tamil Nadu",490000,Experience developing hybrid native/HTML mobile applications.Develop high quality maintainable code.Execute projects and develop against an outlined design.,"JavaScript,native iOS, Android development,React assumptions,Sentry,Bitrise,App Center,Redux,ESLint,Jest,React Native Testing Library,Problem-solving approach"
Full Stack Developer,CDK Global,"Coimbatore, Tamil Nadu",590000,"Writes robust logical documentation that assists other developers.Design, implement, test and maintain node.js react application software.","JavaScript,native iOS, Android development,React assumptions,Sentry,Bitrise,App Center,Redux,ESLint,Jest,React Native Testing Library,Problem-solving approach"
Full Stack Developer,Manipal Dot Net,"Kochi, Kerala",510000,"Minimum 2-5 years of experience in developing iOS app.Proficient with the languages, tools, and frameworks core to iOS development, including Objective-C,…","JavaScript,native iOS, Android development,React assumptions,Sentry,Bitrise,App Center,Redux,ESLint,Jest,React Native Testing Library,Problem-solving approach"
Mobile Developer (React Native),HomeDruid,nan,500000,1.Minimum 5 years of strong real time experience in developing React JS based applications with Redux and/or iOS and Android native applications.,"JavaScript,native iOS, Android development,React assumptions,Sentry,Bitrise,App Center,Redux,ESLint,Jest,React Native Testing Library,Problem-solving approach"
React Native Developer,Talent Zone Consultants,nan,570000,Leverage native APIs for deep integrations with both platforms.Diagnose and fix bugs and performance bottlenecks for performance that feels native.,"JavaScript,native iOS, Android development,React assumptions,Sentry,Bitrise,App Center,Redux,ESLint,Jest,React Native Testing Library,Problem-solving approach"
Full Stack Developer,CDK Global,"New Town, Kolkata, West Bengal",470000,"We are looking for a Hybrid Mobile App Developer.Proficient with Flutter or React Native.Proficient with HTML5/CSS3, JavaScript, Angular JS.","JavaScript,native iOS, Android development,React assumptions,Sentry,Bitrise,App Center,Redux,ESLint,Jest,React Native Testing Library,Problem-solving approach"
Mobile Application Developer - React Native,EnLume,nan,500000,Leverage native APIs for deep integrations with both platforms.Diagnose and fix bugs and performance bottlenecks for performance that feels native.,"JavaScript,native iOS, Android development,React assumptions,Sentry,Bitrise,App Center,Redux,ESLint,Jest,React Native Testing Library,Problem-solving approach"
React Developer,CDK Global,"Noida, Uttar Pradesh",540000,On a day to do basis you will be writing your own code as well as modify the code of other developers to meet client requirements.,"JavaScript,native iOS, Android development,React assumptions,Sentry,Bitrise,App Center,Redux,ESLint,Jest,React Native Testing Library,Problem-solving approach"
Full Stack Developer,Lunavo Labs,"Ahmedabad, Gujarat",560000,"The success and culture of a company is greatly driven by the initial set of folks, so we're looking for smart developers who are very passionate about the…","JavaScript,native iOS, Android development,React assumptions,Sentry,Bitrise,App Center,Redux,ESLint,Jest,React Native Testing Library,Problem-solving approach"
React.js Developer,CDK Global,"Mumbai, Maharashtra",510000,Leverage native APIs for deep integrations with both platforms.Diagnose and fix bugs and performance bottlenecks for performance that feels native.,"JavaScript,native iOS, Android development,React assumptions,Sentry,Bitrise,App Center,Redux,ESLint,Jest,React Native Testing Library,Problem-solving approach"
React Native developer,CDK Global,"Calicut, Kerala",450000,React native : 1 year (Preferred).React native: 1 year (Preferred).Collected from earlier answers and listed as part of your job description.,"JavaScript,native iOS, Android development,React assumptions,Sentry,Bitrise,App Center,Redux,ESLint,Jest,React Native Testing Library,Problem-solving approach"
React Native Developer/Mobile app.developer/ Nodejs /Reactjs...,CDK Global,"Bengaluru, Karnataka",520000,"We are having urgent openings for a consultant role having strong experience in react, Node JS and AWS.Location Address: Pune, State of Mahārāshtra 610011…","JavaScript,native iOS, Android development,React assumptions,Sentry,Bitrise,App Center,Redux,ESLint,Jest,React Native Testing Library,Problem-solving approach"
IOS Developer,Appbylogic,nan,490000,Leverage native APIs for deep integrations with both platforms.Diagnose and fix bugs and performance bottlenecks for performance that feels native.,"JavaScript,native iOS, Android development,React assumptions,Sentry,Bitrise,App Center,Redux,ESLint,Jest,React Native Testing Library,Problem-solving approach"
 JavaScript / React Native / Redux Developer,Protos Healthcare Technologies,"Mohali, Punjab",450000,"Prior experience with native Mobile Application Development for iPhone and Android using (Objective-C and Swift, or Java).Experience with User Data Security.","JavaScript,native iOS, Android development,React assumptions,Sentry,Bitrise,App Center,Redux,ESLint,Jest,React Native Testing Library,Problem-solving approach"
Flutter Developer,Zencode,"Pune, Maharashtra",530000,"Design and develop mobile applications using React Native.NoSQL database Like Couchbase, MongoDB or Firebase.Job Types: Full-time, Part-time, Contract.","JavaScript,native iOS, Android development,React assumptions,Sentry,Bitrise,App Center,Redux,ESLint,Jest,React Native Testing Library,Problem-solving approach"
Full Stack Developer,Ascendz HR Solutions,"Madurai, Tamil Nadu",470000,"Urgent Hiring for React\_Native\_Developer..!!Ø Strong proficiency in React Native.Ø Experiencewith Swift, Objective-C or Java.#Experience* : 2 to 4 years.","JavaScript,native iOS, Android development,React assumptions,Sentry,Bitrise,App Center,Redux,ESLint,Jest,React Native Testing Library,Problem-solving approach"
Full Stack Developer,CDK Global,"Chennai, Tamil Nadu",490000,"Key Skills: - Redux, HTML, CSS, react native, javascript .Leverage native APIs for deep integrations with both platforms.Job Role: - React Native Developer.","JavaScript,native iOS, Android development,React assumptions,Sentry,Bitrise,App Center,Redux,ESLint,Jest,React Native Testing Library,Problem-solving approach"
IOS Developer,Zensar Technologies,"Noida, Uttar Pradesh",520000,We are looking for talented Javascript developer who want to join our engineering team to build great application for Education domain.,"JavaScript,native iOS, Android development,React assumptions,Sentry,Bitrise,App Center,Redux,ESLint,Jest,React Native Testing Library,Problem-solving approach"
React Native Developer,Protos Healthcare Technologies,nan,530000,"We are having urgent openings for a consultant role having strong experience in react, Node JS and AWS.Location Address: Pune, State of Mahārāshtra 610011…","JavaScript,native iOS, Android development,React assumptions,Sentry,Bitrise,App Center,Redux,ESLint,Jest,React Native Testing Library,Problem-solving approach"
React Developer,CDK Global,nan,570000,"Design, Build and maintain applications for the iOS platform.App Integrations with back-end Services.Ensure App Performance, Responsiveness and Good Quality…","JavaScript,native iOS, Android development,React assumptions,Sentry,Bitrise,App Center,Redux,ESLint,Jest,React Native Testing Library,Problem-solving approach"
Full Stack Developer,Protos Healthcare Technologies,"Mumbai, Maharashtra",450000,1.Must have experience in either android app or iOS app development.2.At least 2 years of experience in React Native app development.,"JavaScript,native iOS, Android development,React assumptions,Sentry,Bitrise,App Center,Redux,ESLint,Jest,React Native Testing Library,Problem-solving approach"
Full Stack Developer,Safaltek Software,"Hyderabad, Telangana",560000,Strong background and hands on experience in working with React native mobile applications.We are looking to hire React Native mobile application developers…,"JavaScript,native iOS, Android development,React assumptions,Sentry,Bitrise,App Center,Redux,ESLint,Jest,React Native Testing Library,Problem-solving approach"
React Native Developer,I-Pangram Digital Service LLP(Fromally Jack Soluti...,"Gurgaon, Haryana",500000,"Manipal Dot Net is looking for an experienced Software Engineer to work on Cloud-based Server and client side Application using React, React Native and Kotlin.","JavaScript,native iOS, Android development,React assumptions,Sentry,Bitrise,App Center,Redux,ESLint,Jest,React Native Testing Library,Problem-solving approach"
Android Developer,Tara Blooms,"Mysore, Karnataka",580000,"Key Skills: - Redux, HTML, CSS, react native, javascript .Leverage native APIs for deep integrations with both platforms.Job Role: - React Native Developer.","JavaScript,native iOS, Android development,React assumptions,Sentry,Bitrise,App Center,Redux,ESLint,Jest,React Native Testing Library,Problem-solving approach"
React Native Developer,EnLume,"Chennai, Tamil Nadu",590000,"Services using other tech stacks can be mixed inReact (web) + React Native (native apps).Full Stack Developer FED - NODE JS, React Native - (0057211).","JavaScript,native iOS, Android development,React assumptions,Sentry,Bitrise,App Center,Redux,ESLint,Jest,React Native Testing Library,Problem-solving approach"
React Native Mobile App Developer,Zensar Technologies,"Hyderabad, Telangana",510000,Leverage native APIs for deep integrations with both platforms.Diagnose and fix bugs and performance bottlenecks for performance that feels native.,"JavaScript,native iOS, Android development,React assumptions,Sentry,Bitrise,App Center,Redux,ESLint,Jest,React Native Testing Library,Problem-solving approach"
React Native Mobile Application Developers,Creative Thoughts Informatics,"Pune, Maharashtra",560000,Cross-platform mobile app developers who have developed mobile apps with a familiarity of React Native.Need to join immediately and start to work from home…,"JavaScript,native iOS, Android development,React assumptions,Sentry,Bitrise,App Center,Redux,ESLint,Jest,React Native Testing Library,Problem-solving approach"
React Native Developer (Immediate joiners preferred),IndiaNIC,"Ahmedabad, Gujarat",460000,On a day to do basis you will be writing your own code as well as modify the code of other developers to meet client requirements.,"JavaScript,native iOS, Android development,React assumptions,Sentry,Bitrise,App Center,Redux,ESLint,Jest,React Native Testing Library,Problem-solving approach"
