Job_Name,Company_Name,Location,Salary,Description,Skills
Associate - Projects,Larsen & Toubro Infotech Limited,"Mumbai, Maharashtra",460000,"Thereafter, system readiness to go live is thoroughly checked and then phase review is conducted.SAP B1 software is installed and customized based on the…","Problem-Solving and Administration,Networking,Cloud ,Automation and Scripting,Security and Monitoring,Account Access Management,IoT/Mobile Device Management,Scripting Languages,Hardware Management,SQL"
Office Administrator,eCore Systems,nan,360000,"Experience setting up and configuring monitoring systems.Hands-on experience in Linux/Windows server operating systems, and Web Server technologies including…","Problem-Solving and Administration,Networking,Cloud ,Automation and Scripting,Security and Monitoring,Account Access Management,IoT/Mobile Device Management,Scripting Languages,Hardware Management,SQL"
Sr. System Administrator-Virtualization,CHOKSI VACHHRAJ MAKANJI (CVM),India,370000,"Thereafter, system readiness to go live is thoroughly checked and then phase review is conducted.SAP B1 software is installed and customized based on the…","Problem-Solving and Administration,Networking,Cloud ,Automation and Scripting,Security and Monitoring,Account Access Management,IoT/Mobile Device Management,Scripting Languages,Hardware Management,SQL"
Sap Business One Functional Consultant - Immediate joiner,Unisys,"Bengaluru, Karnataka",350000,"Job Description A) Implementation of Linux based Firewalls , CRM.B) Product Development using Linux Operating System.","Problem-Solving and Administration,Networking,Cloud ,Automation and Scripting,Security and Monitoring,Account Access Management,IoT/Mobile Device Management,Scripting Languages,Hardware Management,SQL"
"Technical Support Engineer, Network Administrator",INNsight.com,"Kolkata, West Bengal",350000,"Experience setting up and configuring monitoring systems.Hands-on experience in Linux/Windows server operating systems, and Web Server technologies including…","Problem-Solving and Administration,Networking,Cloud ,Automation and Scripting,Security and Monitoring,Account Access Management,IoT/Mobile Device Management,Scripting Languages,Hardware Management,SQL"
Desktop Support Engineer,NeuroGen Brain and Spine Institute,"Mumbai, Maharashtra",420000,"Thereafter, system readiness to go live is thoroughly checked and then phase review is conducted.SAP B1 software is installed and customized based on the…","Problem-Solving and Administration,Networking,Cloud ,Automation and Scripting,Security and Monitoring,Account Access Management,IoT/Mobile Device Management,Scripting Languages,Hardware Management,SQL"
Benefits Administrator,ALLINDIA,India,380000,· Upgrade systems with new releases and models.· Familiarity with various operating systems and platforms.· Monitor performance and maintain systems according…,"Problem-Solving and Administration,Networking,Cloud ,Automation and Scripting,Security and Monitoring,Account Access Management,IoT/Mobile Device Management,Scripting Languages,Hardware Management,SQL"
"Technical Support Engineer, Network Administrator",Prime Plus Consultancy&solution,nan,370000,"Customer as part of TSM system administration task.Hyderabad site by TSM L1/L2 system admin team and based on Software.Experience Required : 3-4 yrs,.","Problem-Solving and Administration,Networking,Cloud ,Automation and Scripting,Security and Monitoring,Account Access Management,IoT/Mobile Device Management,Scripting Languages,Hardware Management,SQL"
Office Administrator,Confer Global,"Manali, Chennai, Tamil Nadu",370000,Help in the recruitment and grooming of junior devops system engineers for Cloud Business Services.2 to 3 years of devops system administration experience on…,"Problem-Solving and Administration,Networking,Cloud ,Automation and Scripting,Security and Monitoring,Account Access Management,IoT/Mobile Device Management,Scripting Languages,Hardware Management,SQL"
IT System Engineer,Confer Global,"Chitradurga, Karnataka",580000,"Thereafter, system readiness to go live is thoroughly checked and then phase review is conducted.SAP B1 software is installed and customized based on the…","Problem-Solving and Administration,Networking,Cloud ,Automation and Scripting,Security and Monitoring,Account Access Management,IoT/Mobile Device Management,Scripting Languages,Hardware Management,SQL"
Backend Developer - MERN,Prime Plus Consultancy&solution,"Gurgaon, Haryana",350000,"VoIP and conferencing systems management.Installation, configuration and administration for windows client operating systems.Desktop level support management.","Problem-Solving and Administration,Networking,Cloud ,Automation and Scripting,Security and Monitoring,Account Access Management,IoT/Mobile Device Management,Scripting Languages,Hardware Management,SQL"
Sap Business One Functional Consultant - Immediate joiner,Acute Informatics Private Limited,"New Delhi, Delhi",500000,"Thereafter, system readiness to go live is thoroughly checked and then phase review is conducted.SAP B1 software is installed and customized based on the…","Problem-Solving and Administration,Networking,Cloud ,Automation and Scripting,Security and Monitoring,Account Access Management,IoT/Mobile Device Management,Scripting Languages,Hardware Management,SQL"
Product Expert – Veeva QualityDocs,Prime Plus Consultancy&solution,"Mumbai, Maharashtra",540000,Design compensation and benefits packages.Implement performance review procedures (e.g. quarterly/annual and 360° evaluations).Monitor HR department’s budget.,"Problem-Solving and Administration,Networking,Cloud ,Automation and Scripting,Security and Monitoring,Account Access Management,IoT/Mobile Device Management,Scripting Languages,Hardware Management,SQL"
Sap Business One Functional Consultant - Immediate joiner,CHOKSI VACHHRAJ MAKANJI (CVM),"Durgapur, West Bengal",550000,"Experience setting up and configuring monitoring systems.Hands-on experience in Linux/Windows server operating systems, and Web Server technologies including…","Problem-Solving and Administration,Networking,Cloud ,Automation and Scripting,Security and Monitoring,Account Access Management,IoT/Mobile Device Management,Scripting Languages,Hardware Management,SQL"
System Administrator 2-IT,Prodapt Solutions,nan,420000,"Should have exposure to monitoring systems such as Nagios, zabbix, zenoss, cacti etc.Should be a Graduate with good communication skills.","Problem-Solving and Administration,Networking,Cloud ,Automation and Scripting,Security and Monitoring,Account Access Management,IoT/Mobile Device Management,Scripting Languages,Hardware Management,SQL"
Associate - Projects,Silver group,"Bengaluru, Karnataka",630000,"Thereafter, system readiness to go live is thoroughly checked and then phase review is conducted.SAP B1 software is installed and customized based on the…","Problem-Solving and Administration,Networking,Cloud ,Automation and Scripting,Security and Monitoring,Account Access Management,IoT/Mobile Device Management,Scripting Languages,Hardware Management,SQL"
DevOps System Administrator – AWS,Prime Plus Consultancy&solution,"Hyderabad, Telangana",350000,Maintained Informatica domains including HA systems and Windows environments.Experience with Unix/Linux system administration and troubleshooting.,"Problem-Solving and Administration,Networking,Cloud ,Automation and Scripting,Security and Monitoring,Account Access Management,IoT/Mobile Device Management,Scripting Languages,Hardware Management,SQL"
IT System Engineer,Platforming,"Bengaluru, Karnataka",650000,System administration: 4 years (Preferred).Qualification : * Under Graduate (UG) - BE / BSc / System Administration & Engineering.,"Problem-Solving and Administration,Networking,Cloud ,Automation and Scripting,Security and Monitoring,Account Access Management,IoT/Mobile Device Management,Scripting Languages,Hardware Management,SQL"
VMware Administrator,Prime Plus Consultancy&solution,nan,430000,Ensuring all servers are added into monitoring system with all required parameters.Set up and maintain server operation & provide assistance to otherserver…,"Problem-Solving and Administration,Networking,Cloud ,Automation and Scripting,Security and Monitoring,Account Access Management,IoT/Mobile Device Management,Scripting Languages,Hardware Management,SQL"
Backend Developer - MERN,DXC,"Chennai, Tamil Nadu",340000,"Thereafter, system readiness to go live is thoroughly checked and then phase review is conducted.SAP B1 software is installed and customized based on the…","Problem-Solving and Administration,Networking,Cloud ,Automation and Scripting,Security and Monitoring,Account Access Management,IoT/Mobile Device Management,Scripting Languages,Hardware Management,SQL"
"Technical Support, System Administrator",Prime Plus Consultancy&solution,"Mumbai, Maharashtra",400000,Minimum 8+ years’ experience as a DB2 system and database administrator.HTS – GLT has traditionally been at the heart of development and support of HSBC…,"Problem-Solving and Administration,Networking,Cloud ,Automation and Scripting,Security and Monitoring,Account Access Management,IoT/Mobile Device Management,Scripting Languages,Hardware Management,SQL"
Windchill Administrator,Vikram Rajendra Kumar Singh,nan,330000,"*Job Summary Configuring and Troubleshooting Windows 7 & 10, offer Remote-Assistance to Client computers. * Knowledge inTerminal server configuration and…","Problem-Solving and Administration,Networking,Cloud ,Automation and Scripting,Security and Monitoring,Account Access Management,IoT/Mobile Device Management,Scripting Languages,Hardware Management,SQL"
Associate - Projects,Equiniti,"Mumbai, Maharashtra",400000,"Thereafter, system readiness to go live is thoroughly checked and then phase review is conducted.SAP B1 software is installed and customized based on the…","Problem-Solving and Administration,Networking,Cloud ,Automation and Scripting,Security and Monitoring,Account Access Management,IoT/Mobile Device Management,Scripting Languages,Hardware Management,SQL"
Network & System Administrator,MedTourEasy,"Chennai, Tamil Nadu",310000,"Handling, Managing, Maintaining local windows servers and Domain controller.Configuration and management of DHCP, DNS server, Backup server Planning and…","Problem-Solving and Administration,Networking,Cloud ,Automation and Scripting,Security and Monitoring,Account Access Management,IoT/Mobile Device Management,Scripting Languages,Hardware Management,SQL"
Benefits Administrator,NeuroGen Brain and Spine Institute,nan,330000,"Job Description A) Implementation of Linux based Firewalls , CRM.B) Product Development using Linux Operating System.","Problem-Solving and Administration,Networking,Cloud ,Automation and Scripting,Security and Monitoring,Account Access Management,IoT/Mobile Device Management,Scripting Languages,Hardware Management,SQL"
IT System Engineer,Madhees Techno Consultants Pvt Ltd,nan,440000,Comp- Wipro Infotech Client- Deloitte Payroll- RASPL Skill : Desktop Support Engineer L2 Salary- 24k CTC/20k in hand.First Level support for all Desktop calls.,"Problem-Solving and Administration,Networking,Cloud ,Automation and Scripting,Security and Monitoring,Account Access Management,IoT/Mobile Device Management,Scripting Languages,Hardware Management,SQL"
SAP BASIS Administrator,GSK,nan,490000,"Handling, Managing, Maintaining local windows servers and Domain controller.Configuration and management of DHCP, DNS server, Backup server Planning and…","Problem-Solving and Administration,Networking,Cloud ,Automation and Scripting,Security and Monitoring,Account Access Management,IoT/Mobile Device Management,Scripting Languages,Hardware Management,SQL"
System Administrator,Sourcefit Philippines Inc,"Nashik, Maharashtra",680000,"Should have exposure to monitoring systems such as Nagios, zabbix, zenoss, cacti etc.Should be a Graduate with good communication skills.","Problem-Solving and Administration,Networking,Cloud ,Automation and Scripting,Security and Monitoring,Account Access Management,IoT/Mobile Device Management,Scripting Languages,Hardware Management,SQL"
Manager - Medical Record Department,Orasol Infotech,nan,440000,Job Opening for Desktop support Engineer @ Manali Location.Responsible for handling daily technical support activities related to desktops/laptops.,"Problem-Solving and Administration,Networking,Cloud ,Automation and Scripting,Security and Monitoring,Account Access Management,IoT/Mobile Device Management,Scripting Languages,Hardware Management,SQL"
System Administrator,Prime Plus Consultancy&solution,"Hyderabad, Telangana",530000,"Customer as part of TSM system administration task.Hyderabad site by TSM L1/L2 system admin team and based on Software.Experience Required : 3-4 yrs,.","Problem-Solving and Administration,Networking,Cloud ,Automation and Scripting,Security and Monitoring,Account Access Management,IoT/Mobile Device Management,Scripting Languages,Hardware Management,SQL"
Office Administrator/ Back office Executive,Signant Health,"Mumbai, Maharashtra",630000,"Broad infrastructure IT experience and competence and specialist knowledge in one of more relevant areas of Linux services, such as managing configuration of…","Problem-Solving and Administration,Networking,Cloud ,Automation and Scripting,Security and Monitoring,Account Access Management,IoT/Mobile Device Management,Scripting Languages,Hardware Management,SQL"
Senior SharePoint Administrator,Prime Plus Consultancy&solution,"Pune, Maharashtra",510000,"Experience setting up and configuring monitoring systems.Hands-on experience in Linux/Windows server operating systems, and Web Server technologies including…","Problem-Solving and Administration,Networking,Cloud ,Automation and Scripting,Security and Monitoring,Account Access Management,IoT/Mobile Device Management,Scripting Languages,Hardware Management,SQL"
Sap Business One Functional Consultant - Immediate joiner,ITarium Technologies India Pvt Ltd,nan,390000,"Thereafter, system readiness to go live is thoroughly checked and then phase review is conducted.SAP B1 software is installed and customized based on the…","Problem-Solving and Administration,Networking,Cloud ,Automation and Scripting,Security and Monitoring,Account Access Management,IoT/Mobile Device Management,Scripting Languages,Hardware Management,SQL"
Network Administrator,NeuroGen Brain and Spine Institute,nan,440000,"Broad infrastructure IT experience and competence and specialist knowledge in one of more relevant areas of Linux services, such as managing configuration of…","Problem-Solving and Administration,Networking,Cloud ,Automation and Scripting,Security and Monitoring,Account Access Management,IoT/Mobile Device Management,Scripting Languages,Hardware Management,SQL"
Windows Administrator,ITarium Technologies India Pvt Ltd,nan,620000,"Experience setting up and configuring monitoring systems.Hands-on experience in Linux/Windows server operating systems, and Web Server technologies including…","Problem-Solving and Administration,Networking,Cloud ,Automation and Scripting,Security and Monitoring,Account Access Management,IoT/Mobile Device Management,Scripting Languages,Hardware Management,SQL"
System Administrator,LA Technologies,nan,620000,1-2 years of systems/network experience is required.Perform remote technical support and assistance on all related systems or network issues of clients.,"Problem-Solving and Administration,Networking,Cloud ,Automation and Scripting,Security and Monitoring,Account Access Management,IoT/Mobile Device Management,Scripting Languages,Hardware Management,SQL"
IT System Administrator,"Incept Data Solutions, Inc",nan,320000,"Candidate will be responsible for : -.All the office administration, back office & sales coordination.Receiving and making phone calls.","Problem-Solving and Administration,Networking,Cloud ,Automation and Scripting,Security and Monitoring,Account Access Management,IoT/Mobile Device Management,Scripting Languages,Hardware Management,SQL"
IT System Administrator,Sobha,"Delhi, Delhi",340000,Â Evaluate and recommend security improvements and system upgrades.Â.Knowledge of command structures and system component relationships for latest generation…,"Problem-Solving and Administration,Networking,Cloud ,Automation and Scripting,Security and Monitoring,Account Access Management,IoT/Mobile Device Management,Scripting Languages,Hardware Management,SQL"
"Technical Support, System Administrator",eCore Systems,"Bengaluru, Karnataka",310000,"Thereafter, system readiness to go live is thoroughly checked and then phase review is conducted.SAP B1 software is installed and customized based on the…","Problem-Solving and Administration,Networking,Cloud ,Automation and Scripting,Security and Monitoring,Account Access Management,IoT/Mobile Device Management,Scripting Languages,Hardware Management,SQL"
SAP BASIS Administrator,TAXOSMART,"Mumbai, Maharashtra",440000,"Thereafter, system readiness to go live is thoroughly checked and then phase review is conducted.SAP B1 software is installed and customized based on the…","Problem-Solving and Administration,Networking,Cloud ,Automation and Scripting,Security and Monitoring,Account Access Management,IoT/Mobile Device Management,Scripting Languages,Hardware Management,SQL"
Human Resources Administrator,Orasol Infotech,"Mumbai, Maharashtra",500000,Help in the recruitment and grooming of junior devops system engineers for Cloud Business Services.2 to 3 years of devops system administration experience on…,"Problem-Solving and Administration,Networking,Cloud ,Automation and Scripting,Security and Monitoring,Account Access Management,IoT/Mobile Device Management,Scripting Languages,Hardware Management,SQL"
Systems Engineer - DBA,Sourcefit Philippines Inc,"Mumbai, Maharashtra",590000,"Experience setting up and configuring monitoring systems.Hands-on experience in Linux/Windows server operating systems, and Web Server technologies including…","Problem-Solving and Administration,Networking,Cloud ,Automation and Scripting,Security and Monitoring,Account Access Management,IoT/Mobile Device Management,Scripting Languages,Hardware Management,SQL"
Sr. System Admin-AWS certified,Rotary International,"Pune, Maharashtra",350000,"2.Windows administrators requires to interpret error logs, monitor system performance data,.System administration: 1 year (Preferred).","Problem-Solving and Administration,Networking,Cloud ,Automation and Scripting,Security and Monitoring,Account Access Management,IoT/Mobile Device Management,Scripting Languages,Hardware Management,SQL"
Systems Administrator - Linux Services,DXC,"Bengaluru, Karnataka",490000,Exposure in interfacing SharePoint with external systems.This role involves managing Equiniti’s SharePoint infrastructure and ensuring the up time of…,"Problem-Solving and Administration,Networking,Cloud ,Automation and Scripting,Security and Monitoring,Account Access Management,IoT/Mobile Device Management,Scripting Languages,Hardware Management,SQL"
Human Resources Information Systems Administrator,MedTourEasy,"Namakkal, Tamil Nadu",660000,We are searching for a Database Administrator (DBA) to join our Corporate IT Team.The Database Administrator coordinates day-to-day activities related to…,"Problem-Solving and Administration,Networking,Cloud ,Automation and Scripting,Security and Monitoring,Account Access Management,IoT/Mobile Device Management,Scripting Languages,Hardware Management,SQL"
System Administrator,ISGN,"Hyderabad, Telangana",390000,"Desktop Support Engineers with hands on min 2 years experience in troubleshooting hardware faults, Network issues, Printer installation, experience in…","Problem-Solving and Administration,Networking,Cloud ,Automation and Scripting,Security and Monitoring,Account Access Management,IoT/Mobile Device Management,Scripting Languages,Hardware Management,SQL"
System Administrator,Unisys,nan,650000,"System administration: 1 year (Required).Proactively manage and maintain server, network and firewall systems.A solid understanding of LAN/WAN networking.","Problem-Solving and Administration,Networking,Cloud ,Automation and Scripting,Security and Monitoring,Account Access Management,IoT/Mobile Device Management,Scripting Languages,Hardware Management,SQL"
Sap Business One Functional Consultant - Immediate joiner,Lionbridge Technologies,"Chennai, Tamil Nadu",670000,Maintain system administration documentation and architecture map.On call availability (24×7) for system administration support.Knowledge of SQL and XML.,"Problem-Solving and Administration,Networking,Cloud ,Automation and Scripting,Security and Monitoring,Account Access Management,IoT/Mobile Device Management,Scripting Languages,Hardware Management,SQL"
Sr. System Admin-AWS certified,eCore Systems,"Mulund, Mumbai, Maharashtra",390000,"Experience setting up and configuring monitoring systems.Hands-on experience in Linux/Windows server operating systems, and Web Server technologies including…","Problem-Solving and Administration,Networking,Cloud ,Automation and Scripting,Security and Monitoring,Account Access Management,IoT/Mobile Device Management,Scripting Languages,Hardware Management,SQL"
Linux Administrator - Lead,Prime Plus Consultancy&solution,"Bengaluru, Karnataka",330000,"VoIP and conferencing systems management.Installation, configuration and administration for windows client operating systems.Desktop level support management.","Problem-Solving and Administration,Networking,Cloud ,Automation and Scripting,Security and Monitoring,Account Access Management,IoT/Mobile Device Management,Scripting Languages,Hardware Management,SQL"
Linux System Administrator L2,Prime Plus Consultancy&solution,"Mulund, Mumbai, Maharashtra",470000,"Thereafter, system readiness to go live is thoroughly checked and then phase review is conducted.SAP B1 software is installed and customized based on the…","Problem-Solving and Administration,Networking,Cloud ,Automation and Scripting,Security and Monitoring,Account Access Management,IoT/Mobile Device Management,Scripting Languages,Hardware Management,SQL"
Sap Business One Functional Consultant - Immediate joiner,IBM,"Pune, Maharashtra",420000,"Monitor networks and systems for system uptime, through the use of monitoring software that detects anomalous system behavior.We offer all this and more.","Problem-Solving and Administration,Networking,Cloud ,Automation and Scripting,Security and Monitoring,Account Access Management,IoT/Mobile Device Management,Scripting Languages,Hardware Management,SQL"
Product Expert – Veeva QualityDocs,Sourcefit Philippines Inc,"Chennai, Tamil Nadu",470000,Exposure in interfacing SharePoint with external systems.This role involves managing Equiniti’s SharePoint infrastructure and ensuring the up time of…,"Problem-Solving and Administration,Networking,Cloud ,Automation and Scripting,Security and Monitoring,Account Access Management,IoT/Mobile Device Management,Scripting Languages,Hardware Management,SQL"
Backend Developer - MERN,"SIMS HOSPITAL, Chennai","Hyderabad, Telangana",410000,"Thereafter, system readiness to go live is thoroughly checked and then phase review is conducted.SAP B1 software is installed and customized based on the…","Problem-Solving and Administration,Networking,Cloud ,Automation and Scripting,Security and Monitoring,Account Access Management,IoT/Mobile Device Management,Scripting Languages,Hardware Management,SQL"
Office Administrator/ Back office Executive,Signant Health,"Namakkal, Tamil Nadu",460000,"ESSA2 - VMware and Windows administrator.In-depth knowledge and experience on Windows server operating systems (Windows 2019,2016, 2012, 2008) management and…","Problem-Solving and Administration,Networking,Cloud ,Automation and Scripting,Security and Monitoring,Account Access Management,IoT/Mobile Device Management,Scripting Languages,Hardware Management,SQL"
System Administrator,E3 Retail,nan,640000,"Handling, Managing, Maintaining local windows servers and Domain controller.Configuration and management of DHCP, DNS server, Backup server Planning and…","Problem-Solving and Administration,Networking,Cloud ,Automation and Scripting,Security and Monitoring,Account Access Management,IoT/Mobile Device Management,Scripting Languages,Hardware Management,SQL"
Admin Executive,Larsen & Toubro Infotech Limited,"Hyderabad, Telangana",390000,"Broad infrastructure IT experience and competence and specialist knowledge in one of more relevant areas of Linux services, such as managing configuration of…","Problem-Solving and Administration,Networking,Cloud ,Automation and Scripting,Security and Monitoring,Account Access Management,IoT/Mobile Device Management,Scripting Languages,Hardware Management,SQL"
Admin Executive,Prime Plus Consultancy&solution,"Mumbai, Maharashtra",680000,"Broad infrastructure IT experience and competence and specialist knowledge in one of more relevant areas of Linux services, such as managing configuration of…","Problem-Solving and Administration,Networking,Cloud ,Automation and Scripting,Security and Monitoring,Account Access Management,IoT/Mobile Device Management,Scripting Languages,Hardware Management,SQL"
Desktop Support Engineer L1,eCore Systems,"Ahmedabad, Gujarat",460000,Manages and ensures the viability of the medical records system.Maintains accurate and complete medical records of all patients on paper and in electronic…,"Problem-Solving and Administration,Networking,Cloud ,Automation and Scripting,Security and Monitoring,Account Access Management,IoT/Mobile Device Management,Scripting Languages,Hardware Management,SQL"
