Job_Name,Company_Name,Location,Salary,Description,Skills
Human Resources Information Systems Administrator,Signant Health,"Mumbai, Maharashtra",550000,Manages and ensures the viability of the medical records system.Maintains accurate and complete medical records of all patients on paper and in electronic…,"Problem-Solving and Administration,Networking,Cloud ,Automation and Scripting,Security and Monitoring,Account Access Management,IoT/Mobile Device Management,Scripting Languages,Hardware Management,SQL"
Human Resources Administrator,eCore Systems,"Hyderabad, Telangana",320000,Provides open systems and mainframe enterprise storage and backup support functions to ensure customers realize optimum system performance and availability.,"Problem-Solving and Administration,Networking,Cloud ,Automation and Scripting,Security and Monitoring,Account Access Management,IoT/Mobile Device Management,Scripting Languages,Hardware Management,SQL"
Human Resources Information Systems Administrator,Signant Health,"Pune, Maharashtra",580000,· Upgrade systems with new releases and models.· Familiarity with various operating systems and platforms.· Monitor performance and maintain systems according…,"Problem-Solving and Administration,Networking,Cloud ,Automation and Scripting,Security and Monitoring,Account Access Management,IoT/Mobile Device Management,Scripting Languages,Hardware Management,SQL"
System Administrator,Prime Plus Consultancy&solution,"Mumbai, Maharashtra",590000,"Handling the Linux based cloud servers like Rackspace,AWS,Google cloud,Azure.Handling of SVN & LAMP Servers.Handling of Desktop & Networking related issue.","Problem-Solving and Administration,Networking,Cloud ,Automation and Scripting,Security and Monitoring,Account Access Management,IoT/Mobile Device Management,Scripting Languages,Hardware Management,SQL"
JR IT SYSTEM ADMINISTRATOR,BEECHTREE SYSTEMS & SOLUTIONS PRIVATE LTD.,"Mumbai, Maharashtra",650000,"Primary Skills: Hands on experience on SAN storage systems like DELL-EMC XtremIO, VNX, VNXe and Pure Storage Experience of NAS storage systems like DELL-EMC VNX…","Problem-Solving and Administration,Networking,Cloud ,Automation and Scripting,Security and Monitoring,Account Access Management,IoT/Mobile Device Management,Scripting Languages,Hardware Management,SQL"
Linux Administrator - Lead,Platforming,"Mulund, Mumbai, Maharashtra",470000,"Thereafter, system readiness to go live is thoroughly checked and then phase review is conducted.SAP B1 software is installed and customized based on the…","Problem-Solving and Administration,Networking,Cloud ,Automation and Scripting,Security and Monitoring,Account Access Management,IoT/Mobile Device Management,Scripting Languages,Hardware Management,SQL"
8+ years Sr.Network & Linux & Windows System Admin,Signant Health,"Mumbai, Maharashtra",540000,"Desktop Support Engineers with hands on min 2 years experience in troubleshooting hardware faults, Network issues, Printer installation, experience in…","Problem-Solving and Administration,Networking,Cloud ,Automation and Scripting,Security and Monitoring,Account Access Management,IoT/Mobile Device Management,Scripting Languages,Hardware Management,SQL"
Windows Administrator,Rotary International,nan,360000,"Candidate will be responsible for : -.All the office administration, back office & sales coordination.Receiving and making phone calls.","Problem-Solving and Administration,Networking,Cloud ,Automation and Scripting,Security and Monitoring,Account Access Management,IoT/Mobile Device Management,Scripting Languages,Hardware Management,SQL"
Sap Business One Functional Consultant - Immediate joiner,Orasol Infotech,"Mumbai, Maharashtra",420000,"Thereafter, system readiness to go live is thoroughly checked and then phase review is conducted.SAP B1 software is installed and customized based on the…","Problem-Solving and Administration,Networking,Cloud ,Automation and Scripting,Security and Monitoring,Account Access Management,IoT/Mobile Device Management,Scripting Languages,Hardware Management,SQL"
Sap Business One Functional Consultant - Immediate joiner,ITarium Technologies India Pvt Ltd,"Mumbai, Maharashtra",460000,"Liaise with developers, designers and system administrators to identify new features.You will be responsible for the server side of our web applications.","Problem-Solving and Administration,Networking,Cloud ,Automation and Scripting,Security and Monitoring,Account Access Management,IoT/Mobile Device Management,Scripting Languages,Hardware Management,SQL"
8+ years Sr.Network & Linux & Windows System Admin,ISGN,nan,610000,"Primary Skills: Hands on experience on SAN storage systems like DELL-EMC XtremIO, VNX, VNXe and Pure Storage Experience of NAS storage systems like DELL-EMC VNX…","Problem-Solving and Administration,Networking,Cloud ,Automation and Scripting,Security and Monitoring,Account Access Management,IoT/Mobile Device Management,Scripting Languages,Hardware Management,SQL"
8+ years Sr.Network & Linux & Windows System Admin,Signant Health,"Gurgaon, Haryana",350000,Proficient in SAN S/W and storage administration and integration with operating systems.Proven experience in risk-based systems running on UNIX / LINUX…,"Problem-Solving and Administration,Networking,Cloud ,Automation and Scripting,Security and Monitoring,Account Access Management,IoT/Mobile Device Management,Scripting Languages,Hardware Management,SQL"
System Administrator,"Amick Brown, LLC","Hyderabad, Telangana",510000,We are searching for a Database Administrator (DBA) to join our Corporate IT Team.The Database Administrator coordinates day-to-day activities related to…,"Problem-Solving and Administration,Networking,Cloud ,Automation and Scripting,Security and Monitoring,Account Access Management,IoT/Mobile Device Management,Scripting Languages,Hardware Management,SQL"
Sap Business One Functional Consultant - Immediate joiner,Orasol Infotech,"Mumbai, Maharashtra",360000,· Upgrade systems with new releases and models.· Familiarity with various operating systems and platforms.· Monitor performance and maintain systems according…,"Problem-Solving and Administration,Networking,Cloud ,Automation and Scripting,Security and Monitoring,Account Access Management,IoT/Mobile Device Management,Scripting Languages,Hardware Management,SQL"
Backup & Storage Administrator,ISGN,"Mumbai, Maharashtra",690000,"Experience setting up and configuring monitoring systems.Hands-on experience in Linux/Windows server operating systems, and Web Server technologies including…","Problem-Solving and Administration,Networking,Cloud ,Automation and Scripting,Security and Monitoring,Account Access Management,IoT/Mobile Device Management,Scripting Languages,Hardware Management,SQL"
Consultant Specialist/IT Infrastructure Delivery,Fine Jobs,"Hyderabad, Telangana",470000,Knowledge of computer operating systems and MS Office software.INNsight.com is looking to hire a Back Office Executive to join our busy Admin team.,"Problem-Solving and Administration,Networking,Cloud ,Automation and Scripting,Security and Monitoring,Account Access Management,IoT/Mobile Device Management,Scripting Languages,Hardware Management,SQL"
Admin Executive,Prime Plus Consultancy&solution,"Hyderabad, Telangana",460000,Help in the recruitment and grooming of junior devops system engineers for Cloud Business Services.2 to 3 years of devops system administration experience on…,"Problem-Solving and Administration,Networking,Cloud ,Automation and Scripting,Security and Monitoring,Account Access Management,IoT/Mobile Device Management,Scripting Languages,Hardware Management,SQL"
Cloud Administrator,Silver group,"Ahmedabad, Gujarat",430000,"System administration: 1 year (Required).Proactively manage and maintain server, network and firewall systems.A solid understanding of LAN/WAN networking.","Problem-Solving and Administration,Networking,Cloud ,Automation and Scripting,Security and Monitoring,Account Access Management,IoT/Mobile Device Management,Scripting Languages,Hardware Management,SQL"
Human Resources Administrator,Signant Health,"Pune, Maharashtra",450000,"Candidate will be responsible for : -.All the office administration, back office & sales coordination.Receiving and making phone calls.","Problem-Solving and Administration,Networking,Cloud ,Automation and Scripting,Security and Monitoring,Account Access Management,IoT/Mobile Device Management,Scripting Languages,Hardware Management,SQL"
DevOps System Administrator – AWS,ISGN,nan,380000,Job Opening for Desktop support Engineer @ Manali Location.Responsible for handling daily technical support activities related to desktops/laptops.,"Problem-Solving and Administration,Networking,Cloud ,Automation and Scripting,Security and Monitoring,Account Access Management,IoT/Mobile Device Management,Scripting Languages,Hardware Management,SQL"
Desktop Support Engineer,Prodapt Solutions,nan,420000,Minimum 8+ years’ experience as a DB2 system and database administrator.HTS – GLT has traditionally been at the heart of development and support of HSBC…,"Problem-Solving and Administration,Networking,Cloud ,Automation and Scripting,Security and Monitoring,Account Access Management,IoT/Mobile Device Management,Scripting Languages,Hardware Management,SQL"
Sap Business One Functional Consultant - Immediate joiner,Prime Plus Consultancy&solution,"Mumbai, Maharashtra",660000,"Desktop Support Engineers with hands on min 2 years experience in troubleshooting hardware faults, Network issues, Printer installation, experience in…","Problem-Solving and Administration,Networking,Cloud ,Automation and Scripting,Security and Monitoring,Account Access Management,IoT/Mobile Device Management,Scripting Languages,Hardware Management,SQL"
System Administrator,MedTourEasy,India,560000,Knowledge of system security (e.g. intrusion detection systems) and data backup/recovery.Advises and trains clients regarding server systems.,"Problem-Solving and Administration,Networking,Cloud ,Automation and Scripting,Security and Monitoring,Account Access Management,IoT/Mobile Device Management,Scripting Languages,Hardware Management,SQL"
Desktop Support Engineer,Prime Plus Consultancy&solution,"Mumbai, Maharashtra",390000,"Experience setting up and configuring monitoring systems.Hands-on experience in Linux/Windows server operating systems, and Web Server technologies including…","Problem-Solving and Administration,Networking,Cloud ,Automation and Scripting,Security and Monitoring,Account Access Management,IoT/Mobile Device Management,Scripting Languages,Hardware Management,SQL"
Senior SharePoint Administrator,Prime Plus Consultancy&solution,"Kolkata, West Bengal",610000,"Handling the Linux based cloud servers like Rackspace,AWS,Google cloud,Azure.Handling of SVN & LAMP Servers.Handling of Desktop & Networking related issue.","Problem-Solving and Administration,Networking,Cloud ,Automation and Scripting,Security and Monitoring,Account Access Management,IoT/Mobile Device Management,Scripting Languages,Hardware Management,SQL"
Office Administrator/ Back office Executive,AUSIND Global Trading,nan,590000,"Organize a filing system for important and confidential company documents.Get directions from the Management about the new positions, contribute actively in…","Problem-Solving and Administration,Networking,Cloud ,Automation and Scripting,Security and Monitoring,Account Access Management,IoT/Mobile Device Management,Scripting Languages,Hardware Management,SQL"
Desktop Support Engineer,Acute Informatics Private Limited,"Mumbai, Maharashtra",340000,"Thereafter, system readiness to go live is thoroughly checked and then phase review is conducted.SAP B1 software is installed and customized based on the…","Problem-Solving and Administration,Networking,Cloud ,Automation and Scripting,Security and Monitoring,Account Access Management,IoT/Mobile Device Management,Scripting Languages,Hardware Management,SQL"
Sap Business One Functional Consultant - Immediate joiner,ISGN,nan,330000,"Thereafter, system readiness to go live is thoroughly checked and then phase review is conducted.SAP B1 software is installed and customized based on the…","Problem-Solving and Administration,Networking,Cloud ,Automation and Scripting,Security and Monitoring,Account Access Management,IoT/Mobile Device Management,Scripting Languages,Hardware Management,SQL"
Unix System Administrator,HSBC,"Pune, Maharashtra",480000,"Customer as part of TSM system administration task.Hyderabad site by TSM L1/L2 system admin team and based on Software.Experience Required : 3-4 yrs,.","Problem-Solving and Administration,Networking,Cloud ,Automation and Scripting,Security and Monitoring,Account Access Management,IoT/Mobile Device Management,Scripting Languages,Hardware Management,SQL"
System Administrator,Unisys,"Mumbai, Maharashtra",610000,"Analytical and complex problem-solving skills; troubleshooting and root cause analysis for system-wide issues, including application issues, network issues, and…","Problem-Solving and Administration,Networking,Cloud ,Automation and Scripting,Security and Monitoring,Account Access Management,IoT/Mobile Device Management,Scripting Languages,Hardware Management,SQL"
VMware Administrator,Prime Plus Consultancy&solution,"Pune, Maharashtra",470000,"Broad infrastructure IT experience and competence and specialist knowledge in one of more relevant areas of Linux services, such as managing configuration of…","Problem-Solving and Administration,Networking,Cloud ,Automation and Scripting,Security and Monitoring,Account Access Management,IoT/Mobile Device Management,Scripting Languages,Hardware Management,SQL"
Desktop Support Engineer,Platforming,"Mumbai, Maharashtra",330000,"Monitor networks and systems for system uptime, through the use of monitoring software that detects anomalous system behavior.We offer all this and more.","Problem-Solving and Administration,Networking,Cloud ,Automation and Scripting,Security and Monitoring,Account Access Management,IoT/Mobile Device Management,Scripting Languages,Hardware Management,SQL"
Office Administrator/ Back office Executive,Infiniti Software Solutions,"Manali, Chennai, Tamil Nadu",520000,Provides open systems and mainframe enterprise storage and backup support functions to ensure customers realize optimum system performance and availability.,"Problem-Solving and Administration,Networking,Cloud ,Automation and Scripting,Security and Monitoring,Account Access Management,IoT/Mobile Device Management,Scripting Languages,Hardware Management,SQL"
Jr. Windows System Admin,Orasol Infotech,India,630000,Mylan is a global pharmaceutical company committed to setting new standards in healthcare and providing 7 billion people access to high quality medicine.,"Problem-Solving and Administration,Networking,Cloud ,Automation and Scripting,Security and Monitoring,Account Access Management,IoT/Mobile Device Management,Scripting Languages,Hardware Management,SQL"
System Admin,LA Technologies,"Mumbai, Maharashtra",420000,"Candidate will be responsible for : -.All the office administration, back office & sales coordination.Receiving and making phone calls.","Problem-Solving and Administration,Networking,Cloud ,Automation and Scripting,Security and Monitoring,Account Access Management,IoT/Mobile Device Management,Scripting Languages,Hardware Management,SQL"
Administrator,INNsight.com,"Bengaluru, Karnataka",500000,"Coordinating with Network, Storage and other teams to ensure 24/7 availability of systems.Applying system patches in the live, development environments after…","Problem-Solving and Administration,Networking,Cloud ,Automation and Scripting,Security and Monitoring,Account Access Management,IoT/Mobile Device Management,Scripting Languages,Hardware Management,SQL"
Linux Server Administrator,Precision Techserve Private Limited,"Mulund, Mumbai, Maharashtra",370000,"AWS Certified Associate - SysOps Administrator, Infra Monitoring.Datacenter Operations (SOC - Security operations control & NOC - Network operations control).","Problem-Solving and Administration,Networking,Cloud ,Automation and Scripting,Security and Monitoring,Account Access Management,IoT/Mobile Device Management,Scripting Languages,Hardware Management,SQL"
IT System Administrator,Oracle,nan,380000,"Train system users on functionalities and new features.HRIS Administrator responsibilities include managing our internal databases, keeping employee records in…","Problem-Solving and Administration,Networking,Cloud ,Automation and Scripting,Security and Monitoring,Account Access Management,IoT/Mobile Device Management,Scripting Languages,Hardware Management,SQL"
Linux Server Administrator,Sourcefit Philippines Inc,nan,530000,Design compensation and benefits packages.Implement performance review procedures (e.g. quarterly/annual and 360° evaluations).Monitor HR department’s budget.,"Problem-Solving and Administration,Networking,Cloud ,Automation and Scripting,Security and Monitoring,Account Access Management,IoT/Mobile Device Management,Scripting Languages,Hardware Management,SQL"
Office Administrator,Prime Plus Consultancy&solution,nan,690000,"System administration: 1 year (Required).Proactively manage and maintain server, network and firewall systems.A solid understanding of LAN/WAN networking.","Problem-Solving and Administration,Networking,Cloud ,Automation and Scripting,Security and Monitoring,Account Access Management,IoT/Mobile Device Management,Scripting Languages,Hardware Management,SQL"
Software Engineering- Sales Force,Rotary International,"Mumbai, Maharashtra",660000,"Mandatory – Data bricks ,Data blocks, Azure Cloud*.Sound knowledge in Architecture, Virtualization and Systems Administration.Data Brick: 3 years (Required).","Problem-Solving and Administration,Networking,Cloud ,Automation and Scripting,Security and Monitoring,Account Access Management,IoT/Mobile Device Management,Scripting Languages,Hardware Management,SQL"
Senior UNIX Linux Administrator,IBM,"Hyderabad, Telangana",690000,· Upgrade systems with new releases and models.· Familiarity with various operating systems and platforms.· Monitor performance and maintain systems according…,"Problem-Solving and Administration,Networking,Cloud ,Automation and Scripting,Security and Monitoring,Account Access Management,IoT/Mobile Device Management,Scripting Languages,Hardware Management,SQL"
Jr. Windows System Admin,Smart Youth Group,"Pune, Maharashtra",380000,"Analytical and complex problem-solving skills; troubleshooting and root cause analysis for system-wide issues, including application issues, network issues, and…","Problem-Solving and Administration,Networking,Cloud ,Automation and Scripting,Security and Monitoring,Account Access Management,IoT/Mobile Device Management,Scripting Languages,Hardware Management,SQL"
Office Administrator/ Back office Executive,eCore Systems,"Bengaluru, Karnataka",310000,"Knowledge in Windows & Linux environments, handling high-end servers, Desktop support.System administration on Windows 7,10 pro, Linux (Ubuntu, Cent OS), MAC.","Problem-Solving and Administration,Networking,Cloud ,Automation and Scripting,Security and Monitoring,Account Access Management,IoT/Mobile Device Management,Scripting Languages,Hardware Management,SQL"
Sap Business One Functional Consultant - Immediate joiner,Oracle,"Nashik, Maharashtra",360000,"ESSA2 - VMware and Windows administrator.In-depth knowledge and experience on Windows server operating systems (Windows 2019,2016, 2012, 2008) management and…","Problem-Solving and Administration,Networking,Cloud ,Automation and Scripting,Security and Monitoring,Account Access Management,IoT/Mobile Device Management,Scripting Languages,Hardware Management,SQL"
Systems Engineer - DBA,AUSIND Global Trading,"Mumbai, Maharashtra",670000,"Preparing and maintaining systems (Desktop, laptop, POS or any other hardware) for all team members./ MCA with 2 years of experience.","Problem-Solving and Administration,Networking,Cloud ,Automation and Scripting,Security and Monitoring,Account Access Management,IoT/Mobile Device Management,Scripting Languages,Hardware Management,SQL"
System Administrator 2-IT,Prime Plus Consultancy&solution,nan,620000,Hands-on Experience in troubleshooting of SCCM Complete Infrastructure servers and client issues.SCCM Administration and Deployments for 15000+ User setup -…,"Problem-Solving and Administration,Networking,Cloud ,Automation and Scripting,Security and Monitoring,Account Access Management,IoT/Mobile Device Management,Scripting Languages,Hardware Management,SQL"
Desktop Support Engineer,Equiniti,"New Delhi, Delhi",610000,Ensuring all servers are added into monitoring system with all required parameters.Set up and maintain server operation & provide assistance to otherserver…,"Problem-Solving and Administration,Networking,Cloud ,Automation and Scripting,Security and Monitoring,Account Access Management,IoT/Mobile Device Management,Scripting Languages,Hardware Management,SQL"
IT System Engineer,CHOKSI VACHHRAJ MAKANJI (CVM),"Mulund, Mumbai, Maharashtra",540000,"Thereafter, system readiness to go live is thoroughly checked and then phase review is conducted.SAP B1 software is installed and customized based on the…","Problem-Solving and Administration,Networking,Cloud ,Automation and Scripting,Security and Monitoring,Account Access Management,IoT/Mobile Device Management,Scripting Languages,Hardware Management,SQL"
Sr. System Admin-AWS certified,CHOKSI VACHHRAJ MAKANJI (CVM),"Hyderabad, Telangana",340000,"3 years Power MTA experience or with similar bulk emailing systems such as Qmail, etc.Experience with process-driven workflow for problem resolution,…","Problem-Solving and Administration,Networking,Cloud ,Automation and Scripting,Security and Monitoring,Account Access Management,IoT/Mobile Device Management,Scripting Languages,Hardware Management,SQL"
Technical Trainer - (4 to 12 years of experience),BEECHTREE SYSTEMS & SOLUTIONS PRIVATE LTD.,"Pune, Maharashtra",320000,? Support all upstream and downstream systems for integration and connectivity testing.? Perform sanity check post deployment to ensure smooth production…,"Problem-Solving and Administration,Networking,Cloud ,Automation and Scripting,Security and Monitoring,Account Access Management,IoT/Mobile Device Management,Scripting Languages,Hardware Management,SQL"
Cloud Administrator,Prime Plus Consultancy&solution,"Bengaluru, Karnataka",330000,"Thereafter, system readiness to go live is thoroughly checked and then phase review is conducted.SAP B1 software is installed and customized based on the…","Problem-Solving and Administration,Networking,Cloud ,Automation and Scripting,Security and Monitoring,Account Access Management,IoT/Mobile Device Management,Scripting Languages,Hardware Management,SQL"
Associate - Projects,Warade PackTech Private Limited,nan,400000,We are searching for a Database Administrator (DBA) to join our Corporate IT Team.The Database Administrator coordinates day-to-day activities related to…,"Problem-Solving and Administration,Networking,Cloud ,Automation and Scripting,Security and Monitoring,Account Access Management,IoT/Mobile Device Management,Scripting Languages,Hardware Management,SQL"
Sap Business One Functional Consultant - Immediate joiner,Prime Plus Consultancy&solution,"Bengaluru, Karnataka",620000,"Knowledge of network security systems, intrusion detection systems, and data backup.Troubleshooting system and server errors.","Problem-Solving and Administration,Networking,Cloud ,Automation and Scripting,Security and Monitoring,Account Access Management,IoT/Mobile Device Management,Scripting Languages,Hardware Management,SQL"
DevOps System Administrator – AWS,CHOKSI VACHHRAJ MAKANJI (CVM),"Hyderabad, Telangana",320000,"Broad infrastructure IT experience and competence and specialist knowledge in one of more relevant areas of Linux services, such as managing configuration of…","Problem-Solving and Administration,Networking,Cloud ,Automation and Scripting,Security and Monitoring,Account Access Management,IoT/Mobile Device Management,Scripting Languages,Hardware Management,SQL"
System Administrator,Prime Plus Consultancy&solution,"Mumbai, Maharashtra",330000,Proven experience as the benefits administrator.Confidentiality and efficiency are very important qualities for a benefits administrator.,"Problem-Solving and Administration,Networking,Cloud ,Automation and Scripting,Security and Monitoring,Account Access Management,IoT/Mobile Device Management,Scripting Languages,Hardware Management,SQL"
Associate - Projects,MindSquare,"Bengaluru, Karnataka",620000,Job Opening for Desktop support Engineer @ Manali Location.Responsible for handling daily technical support activities related to desktops/laptops.,"Problem-Solving and Administration,Networking,Cloud ,Automation and Scripting,Security and Monitoring,Account Access Management,IoT/Mobile Device Management,Scripting Languages,Hardware Management,SQL"
Windows Administrator,Rotary International,"Mumbai, Maharashtra",600000,Provide Product expertise in Veeva QualityDocs as a certified Vault platform administrator and QualityDocs system administrator and configuration specialists.,"Problem-Solving and Administration,Networking,Cloud ,Automation and Scripting,Security and Monitoring,Account Access Management,IoT/Mobile Device Management,Scripting Languages,Hardware Management,SQL"
Sap Business One Functional Consultant - Immediate joiner,Oracle,nan,410000,We have an urgent requirement for the profile of Desktop Support Engineer L1 for Mumbai Location .Experience -0.9-3 years max.Notice period -30 Days max.,"Problem-Solving and Administration,Networking,Cloud ,Automation and Scripting,Security and Monitoring,Account Access Management,IoT/Mobile Device Management,Scripting Languages,Hardware Management,SQL"
