Job_Name,Company_Name,Location,Salary,Description,Skills
"Front End Developer | Angular, IonicFrmWrk | 4+ Yrs Exp, Imm...",DISHA Recruitment Services,"Bengaluru, Karnataka",790000,"Project involves “shift left” and developers will be responsible for developing unit and integration tests.Key Skill : Angular 4-8, Ionic Framework, *UI…","Research,Information Architecture,Wireframing,Prototyping,Visual Communication,Communication,Collaboration,UX research,UI prototyping,UX writing,User empathy,Interaction design,Coding,Analytics,Communication skills"
Hiring for Mobile App Developer - Immediate Joining | Delhi...,Beri Udyog Pvt Ltd.,"Bavdhan, Pune, Maharashtra",500000,"1 to 4 years of professional programming experience.Must have strong background in HTML, JavaScript, and CSS, ,Photoshop, Illustrator, AdobeXD.","Research,Information Architecture,Wireframing,Prototyping,Visual Communication,Communication,Collaboration,UX research,UI prototyping,UX writing,User empathy,Interaction design,Coding,Analytics,Communication skills"
Video Editor,Datagrid Digital Marketing Agency,"Mumbai, Maharashtra",380000,Collaborate with product managers and UI developers to define and implement innovative solutions for the product requirements.Years of Exp: 1-3 Years.,"Research,Information Architecture,Wireframing,Prototyping,Visual Communication,Communication,Collaboration,UX research,UI prototyping,UX writing,User empathy,Interaction design,Coding,Analytics,Communication skills"
UI/UX Developer,RXIL,nan,490000,Responsible for meeting expectations and deliverables on time and in high quality.Responsible for the development of web applications and components.,"Research,Information Architecture,Wireframing,Prototyping,Visual Communication,Communication,Collaboration,UX research,UI prototyping,UX writing,User empathy,Interaction design,Coding,Analytics,Communication skills"
Front End - UI Developer for US Based E - Commerce Client,Markowate Technologies Private Limited,nan,800000,"Industry: IT-Software / Software Services.Functional Area: IT Software - Application Programming, Maintenance.Experience: 2 to 6 Years Of exp.","Research,Information Architecture,Wireframing,Prototyping,Visual Communication,Communication,Collaboration,UX research,UI prototyping,UX writing,User empathy,Interaction design,Coding,Analytics,Communication skills"
UI/UX Developer,skilora,"Malad, Mumbai, Maharashtra",420000,Details for UI/UX Developer• • Design and creation of the best online user experience (UX) and user interface (UI) of our digital platform; so that all the…,"Research,Information Architecture,Wireframing,Prototyping,Visual Communication,Communication,Collaboration,UX research,UI prototyping,UX writing,User empathy,Interaction design,Coding,Analytics,Communication skills"
Mobile app developer,Team Ideal pvt. Ltd.,"Navi Mumbai, Maharashtra",600000,Matic Network provides scalable and instant Ethereum transactions using Plasma and PoS side chains.We are an exciting place to work for in the blockchain space…,"Research,Information Architecture,Wireframing,Prototyping,Visual Communication,Communication,Collaboration,UX research,UI prototyping,UX writing,User empathy,Interaction design,Coding,Analytics,Communication skills"
"Front End Developer | Angular, IonicFrmWrk | 4+ Yrs Exp, Imm...",CloudPanel Technologies,nan,810000,You are a talented UI/UX designer & developer with a passion for creating amazing user experiences.You have an impeccable eye for clean and interesting design.,"Research,Information Architecture,Wireframing,Prototyping,Visual Communication,Communication,Collaboration,UX research,UI prototyping,UX writing,User empathy,Interaction design,Coding,Analytics,Communication skills"
Frontend Engineer,Nextwebi,nan,740000,"You can mail us your resume to career@cloudpaneltec.com.UI/UX Developer: 2-4 years experience.# Experience in JavaScript, HTML, CSS.","Research,Information Architecture,Wireframing,Prototyping,Visual Communication,Communication,Collaboration,UX research,UI prototyping,UX writing,User empathy,Interaction design,Coding,Analytics,Communication skills"
UI/UX Developer,DISHA Recruitment Services,"Bengaluru, Karnataka",700000,Details for UI/UX Developer• • Design and creation of the best online user experience (UX) and user interface (UI) of our digital platform; so that all the…,"Research,Information Architecture,Wireframing,Prototyping,Visual Communication,Communication,Collaboration,UX research,UI prototyping,UX writing,User empathy,Interaction design,Coding,Analytics,Communication skills"
"Front End Developer | Angular, IonicFrmWrk | 4+ Yrs Exp, Imm...",Center Of Digital Excellence Private Limited,"Faridabad, Haryana",900000,"Work Experience : Should have 1.5 years of experience as an android developer (using flutter ).Work alongside UX/UI developers and the support team, Optimise…","Research,Information Architecture,Wireframing,Prototyping,Visual Communication,Communication,Collaboration,UX research,UI prototyping,UX writing,User empathy,Interaction design,Coding,Analytics,Communication skills"
"Front End Developer | Angular, IonicFrmWrk | 4+ Yrs Exp, Imm...",3RI TECHNOLOGIES,"The Rutu Estate, Thane, Maharashtra",560000,"We are looking for a ReactJS developer with 2+ years of experience.You will coordinate with other team members, including back-end developers and UX/UI…","Research,Information Architecture,Wireframing,Prototyping,Visual Communication,Communication,Collaboration,UX research,UI prototyping,UX writing,User empathy,Interaction design,Coding,Analytics,Communication skills"
React.js,Oneulsoft,nan,720000,Proven Work Experience as a Ui/ux Designer or Similar Role.Gather and evaluate user requirements with respect to UI in collaboration with product managers and…,"Research,Information Architecture,Wireframing,Prototyping,Visual Communication,Communication,Collaboration,UX research,UI prototyping,UX writing,User empathy,Interaction design,Coding,Analytics,Communication skills"
Front End UI/UX Developer,Trionxt Software,"Mumbai, Maharashtra",460000,"Required Skills Experience with Adobe tools like Photoshop, Illustrator.Experience with wire framing tools like Balsamiq, Justinmind and Indesign.","Research,Information Architecture,Wireframing,Prototyping,Visual Communication,Communication,Collaboration,UX research,UI prototyping,UX writing,User empathy,Interaction design,Coding,Analytics,Communication skills"
"Front End Developer | Angular, IonicFrmWrk | 4+ Yrs Exp, Imm...",Flixx IT Systems Private Limited,India,620000,We are a Digital Solution company specialising in web development and design for E-Commerce and custom web applications. We are looking for senior PHP…,"Research,Information Architecture,Wireframing,Prototyping,Visual Communication,Communication,Collaboration,UX research,UI prototyping,UX writing,User empathy,Interaction design,Coding,Analytics,Communication skills"
UI/UX Developer,ABP Empower,"Hyderabad, Telangana",820000,"Important Note*: Only shortlisted candidates would be contacted for further discussion.We, at CognoAI (AllinCall), are searching for a brilliant, flexible…","Research,Information Architecture,Wireframing,Prototyping,Visual Communication,Communication,Collaboration,UX research,UI prototyping,UX writing,User empathy,Interaction design,Coding,Analytics,Communication skills"
"Front End Developer | Angular, IonicFrmWrk | 4+ Yrs Exp, Imm...",Desprin Enterprises Private Limited,"Ahmedabad, Gujarat",720000,"Project involves “shift left” and developers will be responsible for developing unit and integration tests.Key Skill : Angular 4-8, Ionic Framework, *UI…","Research,Information Architecture,Wireframing,Prototyping,Visual Communication,Communication,Collaboration,UX research,UI prototyping,UX writing,User empathy,Interaction design,Coding,Analytics,Communication skills"
UI Developer - Ionic & Web -mumbai,Desprin Enterprises Private Limited,India,950000,This senior Web developer position is for the buildout of requisite framework and application development for our strategic Settlements UI & Workflow…,"Research,Information Architecture,Wireframing,Prototyping,Visual Communication,Communication,Collaboration,UX research,UI prototyping,UX writing,User empathy,Interaction design,Coding,Analytics,Communication skills"
"Front End Developer | Angular, IonicFrmWrk | 4+ Yrs Exp, Imm...",vSocialize Solutions Private Limited,"Bengaluru, Karnataka",590000,"Project involves “shift left” and developers will be responsible for developing unit and integration tests.Key Skill : Angular 4-8, Ionic Framework, *UI…","Research,Information Architecture,Wireframing,Prototyping,Visual Communication,Communication,Collaboration,UX research,UI prototyping,UX writing,User empathy,Interaction design,Coding,Analytics,Communication skills"
UI VP Role,DISHA Recruitment Services,nan,370000,"You can mail us your resume to career@cloudpaneltec.com.UI/UX Developer: 2-4 years experience.# Experience in JavaScript, HTML, CSS.","Research,Information Architecture,Wireframing,Prototyping,Visual Communication,Communication,Collaboration,UX research,UI prototyping,UX writing,User empathy,Interaction design,Coding,Analytics,Communication skills"
"Front End Developer | Angular, IonicFrmWrk | 4+ Yrs Exp, Imm...",DISHA Recruitment Services,"Vashi, Navi Mumbai, Maharashtra",440000,"Work with other developers to ensure we’re using the right methodologies and practices.You are iOS NINJA who can architect and develop robust, clean, and…","Research,Information Architecture,Wireframing,Prototyping,Visual Communication,Communication,Collaboration,UX research,UI prototyping,UX writing,User empathy,Interaction design,Coding,Analytics,Communication skills"
UX/UI Designer,Center Of Digital Excellence Private Limited,"Coimbatore, Tamil Nadu",960000,"Important Note*: Only shortlisted candidates would be contacted for further discussion.We, at CognoAI (AllinCall), are searching for a brilliant, flexible…","Research,Information Architecture,Wireframing,Prototyping,Visual Communication,Communication,Collaboration,UX research,UI prototyping,UX writing,User empathy,Interaction design,Coding,Analytics,Communication skills"
"Front End Developer | Angular, IonicFrmWrk | 4+ Yrs Exp, Imm...",Venture7 Technology Private Limited,"Coimbatore, Tamil Nadu",940000,"Project involves “shift left” and developers will be responsible for developing unit and integration tests.Key Skill : Angular 4-8, Ionic Framework, *UI…","Research,Information Architecture,Wireframing,Prototyping,Visual Communication,Communication,Collaboration,UX research,UI prototyping,UX writing,User empathy,Interaction design,Coding,Analytics,Communication skills"
UI/ UX Designer,RXIL,"Mumbai, Maharashtra",810000,"Identify and troubleshoot UI/UX problems (e.g. responsiveness).Conduct layout adjustments based on user feedback.Salary: ₹250,000.00 - ₹300,000.00 per year.","Research,Information Architecture,Wireframing,Prototyping,Visual Communication,Communication,Collaboration,UX research,UI prototyping,UX writing,User empathy,Interaction design,Coding,Analytics,Communication skills"
"Front End Developer | Angular, IonicFrmWrk | 4+ Yrs Exp, Imm...",DISHA Recruitment Services,nan,690000,Job Title: UI/UX Developer.Must have good exposure of Magento & Wordpress template.Must have Project Delivery and client coordination.,"Research,Information Architecture,Wireframing,Prototyping,Visual Communication,Communication,Collaboration,UX research,UI prototyping,UX writing,User empathy,Interaction design,Coding,Analytics,Communication skills"
"Front End Developer | Angular, IonicFrmWrk | 4+ Yrs Exp, Imm...",RED CUBE DIGITAL MEDIA,"Banjara Hills, Hyderabad, Telangana",880000,"Dear Applicants, We are currently hiring for full stack developer having atleast 6+ years of experience. PFB the job description: Job Description: …","Research,Information Architecture,Wireframing,Prototyping,Visual Communication,Communication,Collaboration,UX research,UI prototyping,UX writing,User empathy,Interaction design,Coding,Analytics,Communication skills"
UI VP Role,Markowate Technologies Private Limited,"Vashi, Navi Mumbai, Maharashtra",600000,* App design using Eclipse and Java * Software design * Coding * Native app writing ability * Backend web services knowledge * Knowledge of UX and UI * Unit…,"Research,Information Architecture,Wireframing,Prototyping,Visual Communication,Communication,Collaboration,UX research,UI prototyping,UX writing,User empathy,Interaction design,Coding,Analytics,Communication skills"
"Front End Developer | Angular, IonicFrmWrk | 4+ Yrs Exp, Imm...",TNM Online Solutions,"Noida, Uttar Pradesh",470000,Responsible for meeting expectations and deliverables on time and in high quality.Responsible for the development of web applications and components.,"Research,Information Architecture,Wireframing,Prototyping,Visual Communication,Communication,Collaboration,UX research,UI prototyping,UX writing,User empathy,Interaction design,Coding,Analytics,Communication skills"
Software UI Developer 4,TNM Online Solutions,"Bengaluru, Karnataka",780000,"Communicate design ideas and prototypes to developers.Mandatory skills- Illustrator, Photoshop, Adobe suite, PPT skills (infographics), Corel draw (good to…","Research,Information Architecture,Wireframing,Prototyping,Visual Communication,Communication,Collaboration,UX research,UI prototyping,UX writing,User empathy,Interaction design,Coding,Analytics,Communication skills"
"Front End Developer | Angular, IonicFrmWrk | 4+ Yrs Exp, Imm...",TNM Online Solutions,"Delhi, Delhi",770000,"A relevant diploma in related field.Proficiency in graphic design software including Adobe Photoshop, Adobe Illustrator, and other visual design tools.","Research,Information Architecture,Wireframing,Prototyping,Visual Communication,Communication,Collaboration,UX research,UI prototyping,UX writing,User empathy,Interaction design,Coding,Analytics,Communication skills"
"Front End Developer | Angular, IonicFrmWrk | 4+ Yrs Exp, Imm...",Oneulsoft,nan,810000,Collaborate with product managers and UI developers to define and implement innovative solutions for the product requirements.Years of Exp: 1-3 Years.,"Research,Information Architecture,Wireframing,Prototyping,Visual Communication,Communication,Collaboration,UX research,UI prototyping,UX writing,User empathy,Interaction design,Coding,Analytics,Communication skills"
"Front End Developer | Angular, IonicFrmWrk | 4+ Yrs Exp, Imm...",Hitachi Vantara,nan,440000,We are a Digital Solution company specialising in web development and design for E-Commerce and custom web applications. We are looking for senior PHP…,"Research,Information Architecture,Wireframing,Prototyping,Visual Communication,Communication,Collaboration,UX research,UI prototyping,UX writing,User empathy,Interaction design,Coding,Analytics,Communication skills"
Front End UI/UX Developer,10Dumbs,"Coimbatore, Tamil Nadu",970000,Coordinate with web / mobile app developer to integrate the front end work with backend platform.Responsible for creating layout deigns and graphics for the…,"Research,Information Architecture,Wireframing,Prototyping,Visual Communication,Communication,Collaboration,UX research,UI prototyping,UX writing,User empathy,Interaction design,Coding,Analytics,Communication skills"
Lead iOS Developer,AllinCall Research and Solutions,"Delhi, Delhi",820000,Details for UI/UX Developer• • Design and creation of the best online user experience (UX) and user interface (UI) of our digital platform; so that all the…,"Research,Information Architecture,Wireframing,Prototyping,Visual Communication,Communication,Collaboration,UX research,UI prototyping,UX writing,User empathy,Interaction design,Coding,Analytics,Communication skills"
UX Designer,Applied Synergy Technologies Pvt. Ltd.,"Mumbai, Maharashtra",450000,Urgent Hiring For \*FULL\* \*STACK\* \*DEVELOPERS\* Location: - South \*REQUIREMENT\*: - Minimum 7 Years of experience. - Only prefer candidates from IIT…,"Research,Information Architecture,Wireframing,Prototyping,Visual Communication,Communication,Collaboration,UX research,UI prototyping,UX writing,User empathy,Interaction design,Coding,Analytics,Communication skills"
UI/UX Developer,Talent Zone Consultants,"Bavdhan, Pune, Maharashtra",520000,"B.E/B.Tech or MCA in computer or IT.Proficient with Swift and Cocoa Touch.Experience with iOS frameworks such as Core Data, Core Animation, etc.","Research,Information Architecture,Wireframing,Prototyping,Visual Communication,Communication,Collaboration,UX research,UI prototyping,UX writing,User empathy,Interaction design,Coding,Analytics,Communication skills"
UX Designing Internship,Matrid Technologies,nan,430000,* App design using Eclipse and Java * Software design * Coding * Native app writing ability * Backend web services knowledge * Knowledge of UX and UI * Unit…,"Research,Information Architecture,Wireframing,Prototyping,Visual Communication,Communication,Collaboration,UX research,UI prototyping,UX writing,User empathy,Interaction design,Coding,Analytics,Communication skills"
"Front End Developer | Angular, IonicFrmWrk | 4+ Yrs Exp, Imm...",Markowate Technologies Private Limited,"Coimbatore, Tamil Nadu",660000,Coordinate with web / mobile app developer to integrate the front end work with backend platform.Responsible for creating layout deigns and graphics for the…,"Research,Information Architecture,Wireframing,Prototyping,Visual Communication,Communication,Collaboration,UX research,UI prototyping,UX writing,User empathy,Interaction design,Coding,Analytics,Communication skills"
UI/UX Developer,Desprin Enterprises Private Limited,"Vadodara, Gujarat",490000,"You mentor other UI developers when needed.We are looking for an experienced and passionate web developer/designer that thrives in a small, focused and highly…","Research,Information Architecture,Wireframing,Prototyping,Visual Communication,Communication,Collaboration,UX research,UI prototyping,UX writing,User empathy,Interaction design,Coding,Analytics,Communication skills"
ReactJS Developer,Applied Synergy Technologies Pvt. Ltd.,"Hyderabad, Telangana",930000,"Communicate design ideas and prototypes to developers.Mandatory skills- Illustrator, Photoshop, Adobe suite, PPT skills (infographics), Corel draw (good to…","Research,Information Architecture,Wireframing,Prototyping,Visual Communication,Communication,Collaboration,UX research,UI prototyping,UX writing,User empathy,Interaction design,Coding,Analytics,Communication skills"
UX Designer,Oneulsoft,"Delhi, Delhi",930000,Communicate design ideas and prototypes to developers.We are looking for a UI/UX Designer to design software and platforms that meet peopleâ€™s needs.,"Research,Information Architecture,Wireframing,Prototyping,Visual Communication,Communication,Collaboration,UX research,UI prototyping,UX writing,User empathy,Interaction design,Coding,Analytics,Communication skills"
PHP Wordpress Developer,Nextwebi,"Hyderabad, Telangana",380000,Details for UI/UX Developer• • Design and creation of the best online user experience (UX) and user interface (UI) of our digital platform; so that all the…,"Research,Information Architecture,Wireframing,Prototyping,Visual Communication,Communication,Collaboration,UX research,UI prototyping,UX writing,User empathy,Interaction design,Coding,Analytics,Communication skills"
UI/UX Designer,Electrocon Consumer Electronics (I) Ltd. www.educa...,"Mumbai, Maharashtra",790000,"Industry: IT-Software / Software Services.Functional Area: IT Software - Application Programming, Maintenance.Experience: 2 to 6 Years Of exp.","Research,Information Architecture,Wireframing,Prototyping,Visual Communication,Communication,Collaboration,UX research,UI prototyping,UX writing,User empathy,Interaction design,Coding,Analytics,Communication skills"
UX Architect,DISHA Recruitment Services,"Nigdi, Pune, Maharashtra",850000,Responsible for meeting expectations and deliverables on time and in high quality.Responsible for the development of web applications and components.,"Research,Information Architecture,Wireframing,Prototyping,Visual Communication,Communication,Collaboration,UX research,UI prototyping,UX writing,User empathy,Interaction design,Coding,Analytics,Communication skills"
Web Developer,Mentebit Software Solutions,"Mumbai, Maharashtra",870000,Work with a team of amazing developers and designers involved in the design and development of global platforms.M-Tech or advanced degree a plus.,"Research,Information Architecture,Wireframing,Prototyping,Visual Communication,Communication,Collaboration,UX research,UI prototyping,UX writing,User empathy,Interaction design,Coding,Analytics,Communication skills"
UI/UX Developer,Shipkar Express,nan,610000,"Project involves “shift left” and developers will be responsible for developing unit and integration tests.Key Skill : Angular 4-8, Ionic Framework, *UI…","Research,Information Architecture,Wireframing,Prototyping,Visual Communication,Communication,Collaboration,UX research,UI prototyping,UX writing,User empathy,Interaction design,Coding,Analytics,Communication skills"
React/Node Engineer,Oracle,"Delhi, Delhi",770000,"Project involves “shift left” and developers will be responsible for developing unit and integration tests.Key Skill : Angular 4-8, Ionic Framework, *UI…","Research,Information Architecture,Wireframing,Prototyping,Visual Communication,Communication,Collaboration,UX research,UI prototyping,UX writing,User empathy,Interaction design,Coding,Analytics,Communication skills"
"Front End Developer | Angular, IonicFrmWrk | 4+ Yrs Exp, Imm...",Matic Network,"Banjara Hills, Hyderabad, Telangana",400000,"Project involves “shift left” and developers will be responsible for developing unit and integration tests.Key Skill : Angular 4-8, Ionic Framework, *UI…","Research,Information Architecture,Wireframing,Prototyping,Visual Communication,Communication,Collaboration,UX research,UI prototyping,UX writing,User empathy,Interaction design,Coding,Analytics,Communication skills"
Senior PHP Developer,10Dumbs,nan,410000,"Work Experience : Should have 1.5 years of experience as an android developer (using flutter ).Work alongside UX/UI developers and the support team, Optimise…","Research,Information Architecture,Wireframing,Prototyping,Visual Communication,Communication,Collaboration,UX research,UI prototyping,UX writing,User empathy,Interaction design,Coding,Analytics,Communication skills"
Web designers (UI/UX designers & front end developers),Oneulsoft,"Navi Mumbai, Maharashtra",480000,Proven Work Experience as a Ui/ux Designer or Similar Role.Gather and evaluate user requirements with respect to UI in collaboration with product managers and…,"Research,Information Architecture,Wireframing,Prototyping,Visual Communication,Communication,Collaboration,UX research,UI prototyping,UX writing,User empathy,Interaction design,Coding,Analytics,Communication skills"
UI/UX Designer,ABP Empower,nan,810000,Proven Work Experience as a Ui/ux Designer or Similar Role.Gather and evaluate user requirements with respect to UI in collaboration with product managers and…,"Research,Information Architecture,Wireframing,Prototyping,Visual Communication,Communication,Collaboration,UX research,UI prototyping,UX writing,User empathy,Interaction design,Coding,Analytics,Communication skills"
React.js,Datagrid Digital Marketing Agency,"Delhi, Delhi",990000,This senior Web developer position is for the buildout of requisite framework and application development for our strategic Settlements UI & Workflow…,"Research,Information Architecture,Wireframing,Prototyping,Visual Communication,Communication,Collaboration,UX research,UI prototyping,UX writing,User empathy,Interaction design,Coding,Analytics,Communication skills"
UI/UX Designer,DISHA Recruitment Services,"The Rutu Estate, Thane, Maharashtra",600000,"Project involves “shift left” and developers will be responsible for developing unit and integration tests.Key Skill : Angular 4-8, Ionic Framework, *UI…","Research,Information Architecture,Wireframing,Prototyping,Visual Communication,Communication,Collaboration,UX research,UI prototyping,UX writing,User empathy,Interaction design,Coding,Analytics,Communication skills"
Front End UI/UX Developer,ATT Software LLC,"Cannanore, Kerala",450000,Proven Work Experience as a Ui/ux Designer or Similar Role.Gather and evaluate user requirements with respect to UI in collaboration with product managers and…,"Research,Information Architecture,Wireframing,Prototyping,Visual Communication,Communication,Collaboration,UX research,UI prototyping,UX writing,User empathy,Interaction design,Coding,Analytics,Communication skills"
UI Developer,Sapiens,"Vadodara, Gujarat",400000,"Project involves “shift left” and developers will be responsible for developing unit and integration tests.Key Skill : Angular 4-8, Ionic Framework, *UI…","Research,Information Architecture,Wireframing,Prototyping,Visual Communication,Communication,Collaboration,UX research,UI prototyping,UX writing,User empathy,Interaction design,Coding,Analytics,Communication skills"
"Front End Developer | Angular, IonicFrmWrk | 4+ Yrs Exp, Imm...",Nextwebi,nan,420000,"Project involves “shift left” and developers will be responsible for developing unit and integration tests.Key Skill : Angular 4-8, Ionic Framework, *UI…","Research,Information Architecture,Wireframing,Prototyping,Visual Communication,Communication,Collaboration,UX research,UI prototyping,UX writing,User empathy,Interaction design,Coding,Analytics,Communication skills"
